Timestamp,Name of the data collector,Date,Services,Station name,Platform level air temperature,Platform level relative humidity,Number (ID) of the infrared image ,How crowded is the platform?,Time for platform level data collection,Street level air temperature,Street level air temperature - Sunny conditions (complete only if there is no shady spot near the subway entrance),Street level relative humidity,Time for street level data collection,Cloud cover,Rain,Notes,Main level (Turnstile level) air temperature (Only for deep stations),Main level (Turnstile level) relative humidity (Only for deep stations),gtfs_stop_id,platform_collection_timestamp,Platform level heat index,Street level heat index
7/1/2024 15:33:57,Abdou Bah,2024-07-01,7,34 St-Hudson Yards (7),89.4,38.0,,Light,3:27:00 PM,83.4,,32.8,3:38:00 PM,Clear,,,,,726,2024-07-01 15:27:00,89.21138866479997,81.80744253734399
7/1/2024 16:41:30,Abdou Bah,2024-07-01,FQ,72 St,85.8,42.1,,Medium,4:37:00 PM,85.4,,34.5,4:40:00 PM,Clear,,,,,Q03,2024-07-01 16:37:00,85.65040802354402,83.81998355740006
7/1/2024 16:58:29,Abdou Bah,2024-07-01,FQ,86 St,87.7,40.9,,Light,4:58:00 PM,85.2,,32.2,4:54:00 PM,Clear,,,,,Q04,2024-07-01 16:58:00,87.74873906622899,83.30309761161604
7/1/2024 17:10:02,Abdou Bah,2024-07-01,FQ,96 St,83.2,39.7,,Medium,5:04:00 PM,82.2,,35.3,5:08:00 PM,Clear,,,,,Q05,2024-07-01 17:04:00,82.47678004419612,81.10940910709597
7/1/2024 14:31:06,Abdou Bah,2024-07-01,45,"Bowling Green (4, 5)",90.2,38.7,,Medium,2:30:00 PM,86.7,,29.6,2:28:00 PM,Clear,,,,,420,2024-07-01 14:30:00,90.54149060005605,84.362366178124
7/1/2024 11:35:18,Abdou Bah,2024-07-01,1,Court St,81.1,51.0,,Light,11:34:00 AM,81.1,,41.3,11:27:00 AM,Overcast,,,,,R28,2024-07-01 11:34:00,81.9588230972,80.85834609994899
7/1/2024 15:10:37,Abdou Bah,2024-07-01,456,Grand Central-42 St,90.8,39.4,,Heavy,3:07:00 PM,88.3,,33.5,3:10:00 PM,Clear,,,,,631,2024-07-01 15:07:00,91.66220224310408,86.71957187192501
7/1/2024 15:16:26,Abdou Bah,2024-07-01,7,Grand Central-42 St,89.5,45.7,,Heavy,3:16:00 PM,86.1,,34.0,3:11:00 PM,Clear,,,,,723,2024-07-01 15:16:00,91.93746928252506,84.43832357790002
7/1/2024 16:20:53,Abdou Bah,2024-07-01,FQ,"Lexington Av/63 St (Q, F)",84.7,41.1,,Light,4:13:00 PM,82.1,,34.6,4:19:00 PM,Clear,,,,,B08,2024-07-01 16:13:00,84.20129415638905,80.9634967712162
7/1/2024 14:21:57,Abdou Bah,2024-07-01,1,South Ferry (1),84.9,33.6,,Light,2:16:00 PM,93.8,,27.6,2:21:00 PM,Clear,,,,,142,2024-07-01 14:16:00,83.21394797951602,91.97253414726407
7/1/2024 14:47:52,Abdou Bah,2024-07-01,456,Union St,91.0,38.1,,Heavy,2:43:00 AM,82.9,,32.6,2:47:00 AM,Clear,,,,,R32,2024-07-01 02:43:00,91.50375690860018,81.385640063536
7/1/2024 13:55:34,Abdou Bah,2024-07-01,23,"Wall St (2, 3)",89.5,39.3,,Light,1:55:00 AM,85.7,,33.8,1:48:00 PM,Clear,,,,,230,2024-07-01 01:55:00,89.73797121852513,84.00730249969608
7/2/2024 15:01:49,Abdou Bah,2024-07-02,456,"14 St-Union Sq (4, 5, 6)",89.7,36.3,,Medium,2:58:00 PM,90.5,,24.9,3:00:00 PM,Clear,,,,,635,2024-07-02 14:58:00,89.1263880658611,87.49305195692509
7/2/2024 14:06:04,Abdou Bah,2024-07-02,7,34 St-Hudson Yards (7),86.9,34.3,,Light,2:00:00 PM,85.7,,28.7,2:05:00 PM,Clear,,,,,726,2024-07-02 14:00:00,85.3248079678289,83.320667407261
7/2/2024 13:12:21,Abdou Bah,2024-07-02,FQ,72 St,85.6,34.2,,Light,1:07:00 PM,85.8,,27.3,1:12:00 PM,Clear,,,,,Q03,2024-07-02 13:07:00,83.97035882566404,83.25289504517602
7/2/2024 12:57:30,Abdou Bah,2024-07-02,FQ,86 St,85.3,35.7,,Light,12:50:00 PM,85.9,,27.1,12:57:00 PM,Clear,,,,,Q04,2024-07-02 12:50:00,83.90759287630101,83.31930014474096
7/2/2024 12:42:33,Abdou Bah,2024-07-02,FQ,96 St,87.8,31.2,,Light,12:40:00 PM,86.1,,30.6,12:42:00 PM,Clear,,,,,Q05,2024-07-02 12:40:00,85.72462498345604,83.92816325681605
7/2/2024 15:19:59,Abdou Bah,2024-07-02,45,"Bowling Green (4, 5)",84.7,46.9,,Medium,3:15:00 PM,86.1,,31.1,3:19:00 PM,Clear,,,,,420,2024-07-02 15:15:00,85.349583613029,83.99759223450097
7/2/2024 14:40:52,Abdou Bah,2024-07-02,7,Grand Central-42 St,89.2,43.5,,Medium,2:36:00 PM,88.4,,24.6,2:40:00 PM,Clear,,,,,723,2024-07-02 14:36:00,90.6671395913001,85.33248960601607
7/2/2024 14:48:47,Abdou Bah,2024-07-02,456,Grand Central-42 St,89.5,32.9,,Heavy,2:48:00 PM,88.5,,25.0,2:41:00 PM,Clear,,,,,631,2024-07-02 14:48:00,87.99475301372505,85.47967665000012
7/2/2024 13:29:50,Abdou Bah,2024-07-02,FQ,"Lexington Av/63 St (Q, F)",84.4,39.1,,Light,1:25:00 PM,85.1,,43.9,1:29:00 PM,Clear,,,,,B08,2024-07-02 13:25:00,83.54881854963594,85.19839977290096
7/2/2024 15:25:51,Abdou Bah,2024-07-02,1,South Ferry (1),87.3,31.9,,Light,3:25:00 PM,87.9,,34.3,3:22:00 PM,Clear,,,,,142,2024-07-02 15:25:00,85.32116284146908,86.43063244674909
7/2/2024 13:49:17,Abdou Bah,2024-07-02,S,Times Sq-42 St (S),87.3,43.8,,Light,1:45:00 PM,87.0,,24.8,1:48:00 PM,Clear,,,,,902,2024-07-02 13:45:00,87.99829243409594,84.05481904240001
7/2/2024 15:45:12,Abdou Bah,2024-07-02,23,"Wall St (2, 3)",87.3,37.7,,Medium,3:44:00 PM,86.2,,32.3,3:35:00 AM,Clear,,,,,230,2024-07-02 15:44:00,86.46791688870087,84.27024982741597
7/2/2024 15:33:16,Abdou Bah,2024-07-02,1,WTC Cortlandt (1),87.2,31.9,,Light,3:31:00 PM,86.9,,30.5,3:33:00 PM,Clear,,,,,138,2024-07-02 15:31:00,85.21712014520402,84.68855366792491
7/3/2024 13:45:41,Abdou Bah,2024-07-03,456,"14 St-Union Sq (4, 5, 6)",90.3,40.2,,Medium,1:42:00 PM,90.4,,35.4,1:44:00 PM,Clear,,,,,635,2024-07-03 13:42:00,91.1922317108961,89.79842717129608
7/3/2024 13:12:42,Abdou Bah,2024-07-03,7,34 St-Hudson Yards (7),88.4,39.8,,Light,1:07:00 PM,87.8,,34.3,1:12:00 PM,Clear,,,,,726,2024-07-03 13:07:00,88.37822195526408,86.31708299253597
7/3/2024 12:20:34,Abdou Bah,2024-07-03,FQ,72 St,86.9,33.7,,Light,12:17:00 PM,85.2,,31.8,12:20:00 PM,Clear,,,,,Q03,2024-07-03 12:17:00,85.21615760910902,83.25066167993603
7/3/2024 12:05:24,Abdou Bah,2024-07-03,FQ,86 St,86.9,37.2,,Light,12:01:00 PM,85.4,,30.7,12:04:00 PM,Clear,,,,,Q04,2024-07-03 12:01:00,85.89324298692391,83.29241339858407
7/3/2024 11:55:21,Abdou Bah,2024-07-03,FQ,96 St,87.2,31.3,,Light,11:52:00 AM,87.3,,25.6,11:55:00 AM,Clear,,,,,Q05,2024-07-03 11:52:00,85.1169428736359,84.41611956236405
7/3/2024 14:01:22,Abdou Bah,2024-07-03,45,"Bowling Green (4, 5)",89.6,42.9,,Light,1:58:00 PM,88.3,,29.8,2:01:00 PM,Clear,,,,,420,2024-07-03 13:58:00,91.07272918723613,86.00752514337603
7/3/2024 13:32:17,Abdou Bah,2024-07-03,7,Grand Central-42 St,87.6,49.6,,Medium,1:28:00 PM,88.4,,33.4,1:32:00 PM,Clear,,,,,723,2024-07-03 13:28:00,90.24367820937603,86.81301752697621
7/3/2024 13:36:10,Abdou Bah,2024-07-03,456,Grand Central-42 St,88.5,41.2,,Medium,1:35:00 PM,87.9,,34.4,1:33:00 PM,Clear,,,,,631,2024-07-03 13:35:00,88.91393537790017,86.45151136711614
7/3/2024 12:35:34,Abdou Bah,2024-07-03,FQ,Lexington Av/63 St,84.7,40.6,,Light,12:29:00 PM,87.4,89.8,31.7,12:35:00 PM,Clear,,,,,B08,2024-07-03 12:29:00,84.11219545742395,85.39118947026408
7/3/2024 14:07:03,Abdou Bah,2024-07-03,1,South Ferry (1),88.3,31.4,,Light,2:06:00 PM,88.6,,29.9,2:04:00 PM,Clear,,,,,142,2024-07-03 14:06:00,86.29873459854403,86.34481412677601
7/3/2024 12:55:25,Abdou Bah,2024-07-03,S,Times Sq-42 St (S),86.8,46.8,,Medium,12:53:00 PM,88.1,,40.4,12:55:00 PM,Clear,,,,,902,2024-07-03 12:53:00,88.14256594649589,88.14334664695595
7/3/2024 14:29:57,Abdou Bah,2024-07-03,23,"Wall St (2, 3)",87.4,38.5,,Medium,2:29:00 PM,87.3,,34.2,2:16:00 PM,Clear,,,,,230,2024-07-03 14:29:00,86.77113811020023,85.73994556241601
7/3/2024 14:15:44,Abdou Bah,2024-07-03,1,WTC Cortlandt (1),87.6,36.3,,Light,2:13:00 PM,87.5,,34.8,2:15:00 PM,Clear,,,,,138,2024-07-03 14:13:00,86.51180256064409,86.08062399669996
7/8/2024 13:54:45,Abdou Bah,2024-07-08,456,"14 St-Union Sq (4, 5, 6)",90.3,69.0,"353, 354, 355, 356, 357",Medium,1:52:00 PM,92.2,,62.1,1:54:00 PM,Clear,,Some clouds coverage ,,,635,2024-07-08 13:52:00,106.12916978360022,106.69864132594405
7/8/2024 13:21:27,Abdou Bah,2024-07-08,7,34 St-Hudson Yards (7),89.7,51.6,"334, 335, 336,337, 338, 339, 340",Light,1:15:00 PM,89.0,,53.4,1:20:00 PM,Clear,,There is some cloud coverage but not overcast.,89,53.5,726,2024-07-08 13:15:00,94.75119475780403,94.20960551920014
7/8/2024 12:16:43,Abdou Bah,2024-07-08,FQ,72 St,87.8,61.8,"322, 323",Light,12:11:00 PM,88.6,,60.6,12:15:00 PM,Clear,,,88,63.4,Q03,2024-07-08 12:11:00,95.54449952713603,96.753218381216
7/8/2024 12:00:00,Abdou Bah,2024-07-08,FQ,86 St,87.2,48.4,"319, 320, 321",Light,11:52:00 AM,86.3,,56.4,11:56:00 AM,Clear,,,86.4,50.5,Q04,2024-07-08 11:52:00,89.21827773398397,90.381779004124
7/8/2024 11:44:46,Abdou Bah,2024-07-08,FQ,96 St,86.9,45.7,"314, 315, 316, 317, 318",Light,11:40:00 AM,87.2,,54.7,11:44:00 AM,Clear,,,86.3,56.2,Q05,2024-07-08 11:40:00,87.97264196838896,91.38046360203603
7/8/2024 14:12:15,Abdou Bah,2024-07-08,45,"Bowling Green (4, 5)",90.4,64.6,"357, 358, 359, 360, 361a]0",Medium,2:10:00 PM,91.1,,62.0,2:11:00 PM,Clear,,,,,420,2024-07-08 14:10:00,103.47623406777622,103.65531759190026
7/8/2024 13:38:48,Abdou Bah,2024-07-08,7,Grand Central-42 St,88.8,63.2,"341, 342, 343, 344, 345, 346",Medium,1:34:00 PM,90.2,,74.5,1:38:00 PM,Overcast,,,,,723,2024-07-08 13:34:00,98.55890655961625,109.77382267260037
7/8/2024 13:44:55,Abdou Bah,2024-07-08,456,"Grand Central-42 St (4, 5, 6)",91.9,47.3,"347, 348, 349, 350, 351, 352",Heavy,1:44:00 PM,90.8,94.4,51.4,1:40:00 PM,Overcast,,,,,631,2024-07-08 13:44:00,96.92888581690914,96.82356248534415
7/8/2024 12:36:32,Abdou Bah,2024-07-08,FQ,"Lexington Av/63 St (Q, F)",88.7,58.8,"324, 325, 326",Medium,12:32:00 PM,88.8,91.8,60.0,12:36:00 PM,Clear,,,88.4,64,B08,2024-07-08 12:32:00,96.09251111407616,96.90303212480023
7/8/2024 14:19:27,Abdou Bah,2024-07-08,1,South Ferry (1),92.2,59.5,"361, 362, 363, 364, 365, 366",Light,2:19:00 AM,93.0,95,58.5,2:14:00 PM,Clear,,,,,142,2024-07-08 02:19:00,104.8662186366002,106.26960477499999
7/8/2024 14:45:52,Abdou Bah,2024-07-08,23,"Wall St (2, 3)",91.8,56.0,"372, 373, 374, 375, 376, 377, 378, 379",Medium,2:45:00 PM,92.4,94.2,58.8,2:40:00 PM,Clear,,,,,230,2024-07-08 14:45:00,101.59006714480026,104.90619160678403
7/8/2024 14:29:55,Abdou Bah,2024-07-08,1,WTC Cortlandt (1),88.7,59.0,"367, 368, 369, 370, 371",Light,2:26:00 PM,88.7,90.4,60.5,2:29:00 PM,Clear,,,,,138,2024-07-08 14:26:00,96.18932038360009,96.92857662032517
7/9/2024 13:04:55,Abdou Bah,2024-07-09,7,34 St-Hudson Yards (7),88.8,51.2,"402, 403, 404, 405,406, 407",Medium,12:59:00 PM,88.8,89.8,60.0,1:04:00 PM,Clear,,,89.1,63.1,726,2024-07-09 12:59:00,92.90073830329627,96.90303212480023
7/9/2024 12:12:38,Abdou Bah,2024-07-09,FQ,72 St,88.3,62.6,"392, 393, 394, 395",Light,12:07:00 PM,89.0,,63.4,12:11:00 PM,Clear,,There are some cloud formations,88.4,65,Q03,2024-07-09 12:07:00,97.06446701598398,99.15405007919995
7/9/2024 11:58:11,Abdou Bah,2024-07-09,FQ,86 St,87.9,52.6,"385, 386, 387, 388, 389, 390, 391",Medium,11:54:00 AM,87.4,,70.0,11:57:00 AM,Clear,,,86.2,63.8,Q04,2024-07-09 11:54:00,91.84022173233632,98.61448813920023
7/9/2024 11:45:43,Abdou Bah,2024-07-09,FQ,96 St,82.9,45.6,"381, 382, 383, 384",Light,11:42:00 AM,87.3,,64.4,11:45:00 AM,Clear,,,84,56.8,Q05,2024-07-09 11:42:00,83.04943064159605,95.62374216324406
7/9/2024 14:02:46,Abdou Bah,2024-07-09,45,"Bowling Green (4, 5)",92.4,62.4,"422, 423, 424, 425, 426, 427",Medium,2:00:00 PM,92.7,,56.1,2:02:00 PM,Clear,,,,,420,2024-07-09 14:00:00,107.47731588041628,103.83440098730931
7/9/2024 13:31:25,Abdou Bah,2024-07-09,456,"Grand Central-42 St (4, 5, 6)",90.0,58.2,"414, 415, 416",Heavy,1:31:00 PM,90.3,,59.9,1:27:00 PM,Clear,,,,,631,2024-07-09 13:31:00,98.67730987520021,100.34001668650924
7/9/2024 13:25:21,Abdou Bah,2024-07-09,7,Grand Central-42 St (7),87.7,65.1,"408, 409, 410, 411, 412, 413",Medium,1:18:00 PM,90.5,,60.2,1:25:00 PM,Clear,,,,,723,2024-07-09 13:18:00,96.89251641002927,101.00372124520014
7/9/2024 12:25:43,Abdou Bah,2024-07-09,FQ,Lexington Av/63 St,89.1,64.4,"396, 397, 398",Light,12:20:00 PM,89.7,90.7,72.9,12:25:00 PM,Clear,,,89.3,64.9,B08,2024-07-09 12:20:00,99.95874606799597,107.00129761034916
7/9/2024 14:10:00,Abdou Bah,2024-07-09,1,South Ferry (1),92.6,57.8,"428, 429, 430",Medium,2:09:00 PM,89.1,92.7,64.2,2:05:00 PM,Clear,,,,,142,2024-07-09 14:09:00,104.73441454038408,99.84613601854417
7/9/2024 12:42:05,Abdou Bah,2024-07-09,S,Times Sq-42 St (S),90.4,69.4,"399, 400, 401",Medium,12:39:00 PM,92.2,,59.1,12:41:00 PM,Clear,,,,,902,2024-07-09 12:39:00,106.70631472761617,104.59258284850411
7/9/2024 14:41:23,Abdou Bah,2024-07-09,23,"Wall St (2, 3)",92.5,58.6,"439, 440, 441, 442, 443",Medium,2:38:00 PM,92.9,,59.0,2:41:00 PM,Clear,,,,,230,2024-07-09 14:38:00,105.02792865480029,106.3642264564003
7/9/2024 14:18:44,Abdou Bah,2024-07-09,1,WTC Cortlandt (1),90.0,53.6,"431, 432, 433, 434",Light,2:16:00 PM,90.2,91.2,59.7,2:18:00 PM,Clear,,,,,138,2024-07-09 14:16:00,96.2919826168002,99.98418592981619
7/10/2024 13:25:40,Abdou Bah,2024-07-10,456,"14 St-Union Sq (4, 5, 6)",93.5,71.6,"488, 489, 490, 491, 492",Medium,1:22:00 PM,94.3,,58.8,1:25:00 PM,Clear,,,,,635,2024-07-10 13:22:00,118.73904141910019,110.05491374447597
7/10/2024 12:50:42,Abdou Bah,2024-07-10,7,34 St-Hudson Yards (7),90.5,58.0,"469, 470, 471, 472, 473, 474",Light,12:44:00 PM,89.9,91.8,64.3,12:50:00 PM,Clear,,,89.7,70.2,726,2024-07-10 12:44:00,99.72008382750028,101.95753025778922
7/10/2024 11:59:20,Abdou Bah,2024-07-10,FQ,72 St,88.7,58.7,"452, 453, 454, 455",Light,11:54:00 AM,89.7,,66.3,11:59:00 AM,Clear,,,88.5,71.3,Q03,2024-07-10 11:54:00,96.04426161714117,102.6554784160611
7/10/2024 11:47:43,Abdou Bah,2024-07-10,FQ,86 St,88.9,52.0,"448, 449, 450, 451",Medium,11:39:00 AM,88.5,,67.4,11:44:00 AM,Clear,,,87.9,51.5,Q04,2024-07-10 11:39:00,93.4162203159002,100.10162655160045
7/10/2024 11:25:45,Abdou Bah,2024-07-10,FQ,96 St,88.1,40.6,"444, 445, 446, 447",Light,11:22:00 AM,88.4,,64.0,11:25:00 AM,Clear,,,88.8,62.6,Q05,2024-07-10 11:22:00,88.19812753425596,98.01490845840027
7/10/2024 13:50:15,Abdou Bah,2024-07-10,45,"Bowling Green (4, 5)",92.3,65.7,"493, 494, 495, 496",Medium,1:47:00 PM,92.8,,57.5,1:50:00 PM,Clear,,,,,420,2024-07-10 13:47:00,109.69093726698102,105.04035294130034
7/10/2024 13:15:12,Abdou Bah,2024-07-10,456,"Grand Central-42 St (4, 5, 6)",90.9,55.8,"482, 483, 484, 485, 486, 487",Heavy,1:13:00 PM,90.7,,62.2,1:10:00 PM,Clear,,More than 100 people at the platform,,,631,2024-07-10 13:13:00,99.38960170702416,102.7382590644961
7/10/2024 13:09:14,Abdou Bah,2024-07-10,7,Grand Central-42 St (7),90.3,65.8,"475, 476, 477, 478, 479, 480, 481",Heavy,1:04:00 PM,90.6,,63.1,1:08:00 PM,Clear,,More than 100 people at the platform,,,723,2024-07-10 13:04:00,103.98078863889623,103.04854203525619
7/10/2024 12:12:45,Abdou Bah,2024-07-10,FQ,Lexington Av/63 St,88.9,68.5,"457, 458, 459,460, 461",Light,12:06:00 PM,89.2,90.8,79.7,12:12:00 PM,Clear,,,88.7,70.3,B08,2024-07-10 12:06:00,101.81039663032489,110.20123491355602
7/10/2024 12:32:07,Abdou Bah,2024-07-10,S,Times Sq-42 St (S),90.0,69.6,"462, 463, 464, 465, 466, 467, 468",Medium,12:29:00 PM,92.7,,66.0,12:31:00 PM,Clear,,Around 100 people were in the platform,,,902,2024-07-10 12:29:00,105.64990879280008,111.1509623183002
7/10/2024 14:20:56,Abdou Bah,2024-07-10,23,"Wall St (2, 3)",93.8,59.6,"504, 505, 506",Medium,2:18:00 PM,93.4,,63.2,2:20:00 PM,Clear,,,,,230,2024-07-10 14:18:00,109.28318542662404,111.00538023894433
7/10/2024 14:05:27,Abdou Bah,2024-07-10,1,WTC Cortlandt (1),89.5,62.8,"500, 501, 502, 503",Light,2:02:00 PM,89.4,93.6,64.0,2:04:00 PM,Clear,,,,,138,2024-07-10 14:02:00,100.05248634390011,100.48978529040018
7/15/2024 13:37:47,Abdou Bah,2024-07-15,456,"14 St-Union Sq (4, 5, 6)",90.0,68.0,"555 556, 557, 558, 559, 560",Medium,1:34:00 PM,91.6,,61.8,1:37:00 PM,Clear,,,,,635,2024-07-15 13:34:00,104.58007798000015,104.85069546934403
7/15/2024 13:03:09,Abdou Bah,2024-07-15,7,34 St-Hudson Yards (7),91.8,59.4,"539, 540, 541, 542",Light,12:57:00 PM,89.4,,73.7,1:02:00 PM,Clear,,,88.9,69.4,726,2024-07-15 12:57:00,103.76275018966409,106.60906463538402
7/15/2024 12:08:29,Abdou Bah,2024-07-15,FQ,72 St,88.2,58.4,"519, 520, 521, 522, 523, 524",Light,12:04:00 PM,88.5,,68.0,12:08:00 PM,Overcast,,,88,68.3,Q03,2024-07-15 12:04:00,94.84227273702416,100.43937847750033
7/15/2024 11:50:08,Abdou Bah,2024-07-15,FQ,86 St,87.1,57.7,"515, 516, 517, 518",Light,11:45:00 AM,88.1,,65.9,11:49:00 AM,Overcast,,,86.9,62.6,Q04,2024-07-15 11:45:00,92.34022627794891,98.27022130242086
7/15/2024 11:36:35,Abdou Bah,2024-07-15,FQ,96 St,79.8,59.7,"508, 509, 510, 511, 512, 513, 514",Light,11:32:00 AM,83.9,,74.0,11:36:00 AM,Clear,,,82.3,69.6,Q05,2024-07-15 11:32:00,79.8,91.57285714390015
7/15/2024 13:59:51,Abdou Bah,2024-07-15,45,"Bowling Green (4, 5)",89.6,80.3,"561, 562, 563 564",Light,1:52:00 PM,92.1,,63.3,1:59:00 PM,Clear,,,,,420,2024-07-15 13:52:00,112.09473690744449,107.29141127714922
7/15/2024 13:24:05,Abdou Bah,2024-07-15,456,"Grand Central-42 St (4, 5, 6)",89.5,53.1,"549, 550, 551, 552, 553, 554",Heavy,1:23:00 PM,89.3,,63.8,1:20:00 PM,Clear,,,,,631,2024-07-15 13:23:00,95.04942919272509,100.12249550497606
7/15/2024 13:18:48,Abdou Bah,2024-07-15,7,Grand Central-42 St (7),88.0,72.2,"544, 545, 546, 547, 548",Medium,1:15:00 PM,89.2,,76.1,1:18:00 PM,Clear,,,,,723,2024-07-15 13:15:00,101.46203659120013,107.62244899464432
7/15/2024 12:22:19,Abdou Bah,2024-07-15,FQ,"Lexington Av/63 St (Q, F)",88.9,66.4,"525, 526, 527, 528, 529, 530, 531",Light,12:15:00 PM,89.0,92,74.4,12:21:00 PM,Overcast,,,88.8,79.4,B08,2024-07-15 12:15:00,100.58264764095625,105.8220947152002
7/15/2024 14:09:05,Abdou Bah,2024-07-15,1,South Ferry (1),92.5,56.2,"565, 566, 567, 568, 569, 570",Medium,2:08:00 PM,93.1,,71.3,2:05:00 PM,Clear,,,,,142,2024-07-15 14:08:00,103.40731783319995,117.03782937190923
7/15/2024 12:38:00,Abdou Bah,2024-07-15,S,Times Sq-42 St (S),91.1,67.4,"535, 536, 537, 538",Medium,12:35:00 PM,92.6,,61.9,12:37:00 PM,Clear,,,,,902,2024-07-15 12:35:00,107.37364238257626,107.66930360661605
7/15/2024 14:32:32,Abdou Bah,2024-07-15,23,"Wall St (2, 3)",92.6,69.3,"577, 578, 579",Light,2:29:00 PM,93.1,,63.6,2:32:00 PM,Clear,,,,,230,2024-07-15 14:29:00,113.56979559282428,110.43195839951632
7/15/2024 14:17:32,Abdou Bah,2024-07-15,1,WTC Cortlandt (1),89.7,65.6,"572, 573, 574, 575, 576",Light,2:14:00 PM,88.7,90.4,72.0,2:17:00 PM,Clear,,,,,138,2024-07-15 14:14:00,102.2235271201242,103.36931127310025
7/16/2024 13:17:20,Abdou Bah,2024-07-16,456,"14 St-Union Sq (4, 5, 6)",90.1,61.9,"623, 624, 625, 626, 627, 628",Heavy,1:14:00 PM,93.3,,48.1,1:17:00 PM,Clear,,,,,635,2024-07-16 13:14:00,101.02438384694122,100.19000858334904
7/16/2024 12:45:15,Abdou Bah,2024-07-16,7,34 St-Hudson Yards (7),89.7,53.8,"604, 605, 606, 607, 608, 609, 610, 611",Light,12:40:00 PM,89.0,,67.2,12:44:00 PM,Clear,,,88.9,54.5,726,2024-07-16 12:40:00,95.77824948993609,101.31197330080012
7/16/2024 11:43:41,Abdou Bah,2024-07-16,FQ,72 St,88.9,49.8,"589, 590, 591, 592, 593",Light,11:39:00 AM,89.6,,51.2,11:43:00 AM,Clear,,,88.8,55.9,Q03,2024-07-16 11:39:00,92.5138515110242,94.38077201766421
7/16/2024 11:33:46,Abdou Bah,2024-07-16,FQ,86 St,86.8,48.3,"585, 586, 587, 588",Light,11:29:00 AM,88.4,,61.0,11:33:00 AM,Clear,,,86.9,49.3,Q04,2024-07-16 11:29:00,88.58203547315593,96.50093316720009
7/16/2024 11:20:42,Abdou Bah,2024-07-16,FQ,96 St,83.7,38.9,"581, 582, 583, 584",Light,11:16:00 AM,86.1,,55.6,11:20:00 AM,Clear,,,83.7,48,Q05,2024-07-16 11:16:00,82.83388947562894,89.76284790231601
7/16/2024 13:38:57,Abdou Bah,2024-07-16,45,"Bowling Green (4, 5)",91.9,65.6,"630, 631, 632, 633, 634, 635",Medium,1:36:00 PM,93.3,,63.5,1:38:00 PM,Clear,,,,,420,2024-07-16 13:36:00,108.41887430311613,110.94976870892503
7/16/2024 13:07:01,Abdou Bah,2024-07-16,456,"Grand Central-42 St (4, 5, 6)",90.2,51.3,"616, 617, 618, 619, 620, 621, 622",Heavy,1:06:00 PM,90.5,,56.6,1:02:00 PM,Clear,,,,,631,2024-07-16 13:06:00,95.58090814741607,98.93378844280015
7/16/2024 13:00:56,Abdou Bah,2024-07-16,7,Grand Central-42 St (7),89.2,67.6,"612, 613, 614, 615a",Medium,12:56:00 PM,90.1,,57.1,1:00:00 PM,Clear,,,,,723,2024-07-16 12:56:00,102.0911638304641,98.3077085687012
7/16/2024 12:02:35,Abdou Bah,2024-07-16,FQ,"Lexington Av/63 St (Q, F)",89.7,58.7,"594, 595, 596, 597, 598, 599",Light,11:57:00 AM,89.6,,67.2,12:02:00 PM,Clear,,,88.8,61.1,B08,2024-07-16 11:57:00,98.26300725210123,102.9425694999042
7/16/2024 13:44:44,Abdou Bah,2024-07-16,1,South Ferry (1),93.9,54.5,"636, 637, 638, 639",Medium,1:44:00 PM,94.1,,50.2,1:41:00 PM,Clear,,,,,142,2024-07-16 13:44:00,105.72322534352514,103.25264552318401
7/16/2024 12:23:18,Abdou Bah,2024-07-16,S,Times Sq-42 St (S),91.5,63.1,"600, 601, 602, 603, 604, 605",Medium,12:20:00 PM,92.8,,62.9,12:23:00 PM,Clear,,,,,902,2024-07-16 12:20:00,105.47257869232507,108.99883383504437
7/16/2024 14:08:01,Abdou Bah,2024-07-16,23,"Wall St (2, 3)",91.5,50.1,"643, 644, 645, 646, 647, 648",Medium,2:05:00 PM,93.1,,53.2,2:07:00 PM,Clear,,,,,230,2024-07-16 14:05:00,97.5742329253251,102.88988638172408
7/16/2024 13:53:05,Abdou Bah,2024-07-16,1,WTC Cortlandt (1),90.1,56.1,"640, 641, 642, 643",Light,1:50:00 PM,89.4,,53.6,1:52:00 PM,Clear,,,,,138,2024-07-16 13:50:00,97.77576357058125,95.0828388669762
7/17/2024 13:27:25,Abdou Bah,2024-07-17,456,"14 St-Union Sq (4, 5, 6)",91.6,66.6,"694, 695, 696, 697",Heavy,1:24:00 PM,93.1,,63.6,1:27:00 PM,Clear,,,,,635,2024-07-17 13:24:00,108.27547968809607,110.43195839951632
7/17/2024 12:50:15,Abdou Bah,2024-07-17,7,34 St-Hudson Yards (7),90.7,61.6,"678, 679, 680, 681",Medium,12:44:00 PM,89.4,,63.3,12:50:00 PM,Clear,,,89 5,67.5,726,2024-07-17 12:44:00,102.36073993364403,100.08837444274425
7/17/2024 11:55:37,Abdou Bah,2024-07-17,FQ,72 St,89.1,55.6,"661, 662, 663, 664",Medium,11:51:00 AM,89.3,,55.7,11:55:00 AM,Clear,,,88.9,51.7,Q03,2024-07-17 11:51:00,95.41037058447607,95.87029279806126
7/17/2024 11:33:55,Abdou Bah,2024-07-17,FQ,86 St,87.7,55.4,"657, 658, 659, 660",Light,11:29:00 AM,88.3,,56.5,11:33:00 AM,Clear,,,87.5,55.6,Q04,2024-07-17 11:29:00,92.57068670574421,94.19851468372488
7/17/2024 11:22:18,Abdou Bah,2024-07-17,FQ,96 St,89.1,39.1,"649, 650, 651, 652, 653, 654, 655, 656",Light,11:18:00 AM,87.0,,55.7,11:22:00 AM,Clear,,,87,53.3,Q05,2024-07-17 11:18:00,89.12423210162103,91.38956409340003
7/17/2024 13:51:33,Abdou Bah,2024-07-17,45,"Bowling Green (4, 5)",91.4,63.1,"699, 700, 701, 702, 703, 704, 705",Medium,1:48:00 PM,92.7,,59.6,1:51:00 PM,Clear,,,,,420,2024-07-17 13:48:00,105.1982195051762,106.26115951356422
7/17/2024 13:14:01,Abdou Bah,2024-07-17,456,"Grand Central-42 St (4, 5, 6)",90.5,50.1,"686, 687, 688, 689, 690, 691, 692, 693",Heavy,1:13:00 PM,90.7,,55.5,1:09:00 PM,Clear,,,,,631,2024-07-17 13:13:00,95.59454042192513,98.77450603932522
7/17/2024 13:08:24,Abdou Bah,2024-07-17,7,Grand Central-42 St (7),89.1,70.1,"682, 683, 684, 685",Medium,1:03:00 PM,90.7,,54.8,1:07:00 PM,Clear,,,,,723,2024-07-17 13:03:00,103.3487545025412,98.3923063534362
7/17/2024 12:13:18,Abdou Bah,2024-07-17,FQ,Lexington Av/63 St,88.4,53.6,"665, 666, 667, 668, 669, 670, 671",Light,12:07:00 PM,89.2,,63.6,12:13:00 PM,Clear,,,88.4,65.5,B08,2024-07-17 12:07:00,93.15288799369637,99.7592391261442
7/17/2024 12:33:10,Abdou Bah,2024-07-17,S,Times Sq-42 St (S),91.3,65.4,"672, 673, 674, 675, 676, 677",Medium,12:30:00 PM,92.9,,54.0,12:33:00 PM,Clear,,,,,902,2024-07-17 12:30:00,106.5243463243041,102.93586809790007
7/17/2024 14:11:26,Abdou Bah,2024-07-17,1,WTC Cortlandt (1),90.0,60.8,"612, 613, 614, 615, 616, 617",Light,2:08:00 PM,88.8,,55.0,2:11:00 PM,Clear,,,,,138,2024-07-17 14:08:00,100.1344443592001,94.52979835680007
7/22/2024 13:23:37,Abdou Bah,2024-07-22,456,"14 St-Union Sq (4, 5, 6)",91.7,62.3,"774, 775, 776, 777, 778, 779, 780, 781",Heavy,1:20:00 PM,93.3,,59.5,1:23:00 PM,Overcast,,,,,635,2024-07-22 13:20:00,105.46518150042117,107.81629967572518
7/22/2024 12:46:24,Abdou Bah,2024-07-22,7,34 St-Hudson Yards (7),89.4,59.2,"757, 758, 759, 760, 761",Medium,12:41:00 PM,88.0,,57.5,12:46:00 PM,Overcast,,,88.5,66.8,726,2024-07-22 12:41:00,97.84589015030417,94.03225203250007
7/22/2024 11:51:34,Abdou Bah,2024-07-22,FQ,72 St,88.3,56.0,"736, 737, 738, 739, 740",Light,11:47:00 AM,87.8,,62.5,11:51:00 AM,Clear,,,88,61.1,Q03,2024-07-22 11:47:00,93.98000494030005,95.87254875179985
7/22/2024 11:33:41,Abdou Bah,2024-07-22,FQ,86 St,86.6,54.3,"730, 731, 732, 733, 734, 735",Light,11:29:00 AM,88.3,,57.3,11:33:00 AM,Clear,,,87.1,55.4,Q04,2024-07-22 11:29:00,90.18445000674382,94.55330013910103
7/22/2024 11:18:09,Abdou Bah,2024-07-22,FQ,96 St,84.6,42.3,"724, 725, 726, 727, 728, 729",Light,11:12:00 AM,85.2,,65.2,11:17:00 AM,Clear,,,84.2,58.2,Q05,2024-07-22 11:12:00,84.31085502466401,91.37390154489607
7/22/2024 13:41:30,Abdou Bah,2024-07-22,45,"Bowling Green (4, 5)",93.7,55.2,,Medium,1:38:00 PM,92.5,,57.6,1:41:00 PM,Clear,,,,,420,2024-07-22 13:38:00,105.71776102655627,104.34281570630014
7/22/2024 13:10:01,Abdou Bah,2024-07-22,456,"Grand Central-42 St (4, 5, 6)",89.8,67.3,"767, 768, 769, 770, 771, 772, 773",Heavy,1:09:00 PM,90.3,,59.5,1:05:00 PM,Overcast,,,,,631,2024-07-22 13:09:00,103.5605870037363,100.10821859872522
7/22/2024 13:04:16,Abdou Bah,2024-07-22,7,Grand Central-42 St (7),88.7,64.4,"762, 763, 764, 765, 766",Medium,12:59:00 PM,90.4,,61.6,1:03:00 PM,Overcast,,,,,723,2024-07-22 12:59:00,98.95954959036433,101.59818839001613
7/22/2024 12:11:11,Abdou Bah,2024-07-22,FQ,Lexington Av/63 St,89.7,53.9,"742, 743, 744, 745, 746",Light,12:06:00 PM,88.5,,59.4,12:10:00 PM,Clear,,,88.1,65.4,B08,2024-07-22 12:06:00,95.82623768086927,95.94716764760022
7/22/2024 13:46:52,Abdou Bah,2024-07-22,1,South Ferry (1),90.5,49.1,,Light,1:46:00 PM,90.4,,52.3,1:44:00 PM,Clear,,,,,142,2024-07-22 13:46:00,95.12629327592515,96.46432089560412
7/22/2024 12:29:45,Abdou Bah,2024-07-22,FQ,Times Sq-42 St (S),89.3,63.7,"747, 748, 749, 750, 751, 752",Medium,12:27:00 PM,91.3,,62.5,12:29:00 PM,Clear,,,,,902,2024-07-22 12:27:00,100.06562283854123,104.51916083692512
7/22/2024 14:09:17,Abdou Bah,2024-07-22,23,"Wall St (2, 3)",89.6,50.7,,Medium,2:07:00 PM,89.9,,48.8,2:09:00 PM,Clear,,,,,230,2024-07-22 14:07:00,94.15957642104411,93.88379061588421
7/22/2024 13:57:13,Abdou Bah,2024-07-22,1,WTC Cortlandt (1),88.6,52.3,,Light,1:55:00 PM,87.7,,60.6,1:56:00 PM,Clear,,,,,138,2024-07-22 13:55:00,92.98707488018411,94.77827810734401
7/24/2024 13:26:29,Abdou Bah,2024-07-24,456,"14 St-Union Sq (4, 5, 6)",91.7,62.3,"824, 825, 826, 827, 828, 829",Heavy,1:22:00 PM,88.5,,53.1,1:24:00 PM,Clear,,,,,635,2024-07-24 13:22:00,105.46518150042117,93.13239769572516
7/24/2024 14:15:54,Abdou Bah,2024-07-24,23,"14 St-Union Sq (4, 5, 6)",90.5,69.8,"847, 848, 849, 850",Medium,2:11:00 PM,91.3,,61.7,2:14:00 PM,Overcast,,,,,635,2024-07-24 14:11:00,107.29202820520034,103.9851197475011
7/24/2024 12:53:01,Abdou Bah,2024-07-24,7,34 St-Hudson Yards (7),89.4,55.2,"812, 813, 814, 815, 816",Light,12:45:00 PM,88.6,,75.4,12:50:00 PM,Overcast,,,88.5,71.9,726,2024-07-24 12:45:00,95.83695318454426,105.21960828681603
7/24/2024 11:55:56,Abdou Bah,2024-07-24,FQ,72 St,86.9,56.6,"798, 799, 800, 801, 802",Light,11:49:00 AM,87.3,,68.1,11:53:00 AM,Clear,,,87,62.2,Q03,2024-07-24 11:49:00,91.54108119793585,97.39504808738879
7/24/2024 11:37:34,Abdou Bah,2024-07-24,FQ,86 St,85.4,56.3,"794, 795, 796, 797",Light,11:29:00 AM,87.6,,66.3,11:35:00 AM,Clear,,,86.8,55.2,Q04,2024-07-24 11:29:00,88.80000071634393,97.24372606144402
7/24/2024 11:20:20,Abdou Bah,2024-07-24,FQ,96 St,78.4,68.0,"791, 792, 793",Medium,11:16:00 AM,82.2,,72.3,11:18:00 AM,Clear,,,81.4,74.2,Q05,2024-07-24 11:16:00,78.4,87.34987202117615
7/24/2024 13:41:09,Abdou Bah,2024-07-24,45,"Bowling Green (4, 5)",90.8,64.3,"830, 831, 832, 833",Medium,1:38:00 PM,91.0,,62.5,1:40:00 PM,Clear,,,,,420,2024-07-24 13:38:00,104.3673980971563,103.71832507500024
7/24/2024 13:14:53,Abdou Bah,2024-07-24,456,"Grand Central-42 St (4, 5, 6)",90.9,57.1,"820, 821, 822, 823, 824",Heavy,1:14:00 PM,90.0,,62.2,1:10:00 PM,Clear,,,,,631,2024-07-24 13:14:00,100.134237081741,100.95163396320007
7/24/2024 13:09:45,Abdou Bah,2024-07-24,7,Grand Central-42 St (7),90.3,67.8,"817, 818, 819",Heavy,1:04:00 PM,91.0,,76.9,1:09:00 PM,Clear,,,,,723,2024-07-24 13:04:00,105.30920884577627,114.45259114860016
7/24/2024 12:13:50,Abdou Bah,2024-07-24,FQ,Lexington Av/63 St,86.5,58.1,"803, 804, 805, 806",Light,12:06:00 PM,87.8,,70.9,12:11:00 PM,Clear,,,87.2,65.2,B08,2024-07-24 12:06:00,91.35227686232507,100.16992358930406
7/24/2024 13:47:57,Abdou Bah,2024-07-24,1,South Ferry (1),88.5,45.3,"834, 835, 836, 837, 838, 839, 840",Medium,1:47:00 PM,89.9,,58.0,1:43:00 PM,Overcast,,,,,142,2024-07-24 13:47:00,90.20517747252521,98.34162389430006
7/24/2024 12:31:10,Abdou Bah,2024-07-24,S,Times Sq-42 St (S),90.4,70.9,"805, 806, 807, 809, 810, 811",Light,12:28:00 PM,91.2,,62.6,12:30:00 PM,Overcast,,,,,902,2024-07-24 12:28:00,107.77255819203634,104.31770073174411
7/24/2024 13:58:57,Abdou Bah,2024-07-24,1,WTC Cortlandt (1),88.5,61.5,"841, 842, 843, 844, 845, 846",Light,1:56:00 PM,88.2,,58.0,1:58:00 PM,Overcast,,,,,138,2024-07-24 13:56:00,96.97488066312545,94.66173021120012
7/25/2024 13:05:05,Abdou Bah,2024-07-25,456,"14 St-Union Sq (4, 5, 6)",91.9,55.6,"892, 893, 894, 895",Medium,1:02:00 PM,91.1,,43.2,1:04:00 PM,Clear,,,,,635,2024-07-25 13:02:00,101.57992346991617,93.6032676843641
7/25/2024 12:29:17,Abdou Bah,2024-07-25,7,34 St-Hudson Yards (7),90.3,49.1,"879, 880, 881, 882",Medium,12:24:00 PM,87.7,,51.6,12:29:00 PM,Clear,,,88.8,47.3,726,2024-07-25 12:24:00,94.75155111694892,91.1171429453241
7/25/2024 11:28:35,Abdou Bah,2024-07-25,FQ,72 St,88.6,52.3,"861, 862, 863, 864",Medium,11:24:00 AM,88.7,,58.3,11:28:00 AM,Clear,,,89.2,50.3,Q03,2024-07-25 11:24:00,92.98707488018411,95.85229788158114
7/25/2024 11:10:39,Abdou Bah,2024-07-25,FQ,86 St,88.1,49.3,"856, 857, 858, 859, 860",Medium,11:05:00 AM,88.3,,56.4,11:10:00 AM,Clear,,,88,47.2,Q04,2024-07-25 11:05:00,90.95823196278891,94.15461389404393
7/25/2024 10:59:22,Abdou Bah,2024-07-25,FQ,96 St,85.6,43.6,"851, 852, 853, 854, 855",Medium,10:55:00 AM,85.3,,53.2,10:59:00 AM,Clear,,,84.3,48.8,Q05,2024-07-25 10:55:00,85.73741258121593,87.73536598647593
7/25/2024 13:24:14,Abdou Bah,2024-07-25,45,"Bowling Green (4, 5)",89.3,61.8,"897, 898, 899, 900, 901",Medium,1:22:00 PM,91.3,,63.3,1:24:00 PM,Clear,,,,,420,2024-07-25 13:22:00,99.00582977569626,105.06146723566113
7/25/2024 12:53:50,Abdou Bah,2024-07-25,456,"Grand Central-42 St (4, 5, 6)",89.0,52.3,"889, 890, 891, 892",Heavy,12:53:00 PM,89.0,,53.4,12:48:00 PM,Clear,,,,,631,2024-07-25 12:53:00,93.73068627180017,94.20960551920014
7/25/2024 12:47:24,Abdou Bah,2024-07-25,7,Grand Central-42 St (7),88.3,69.5,"884, 885, 886, 887, 888",Medium,12:43:00 PM,89.1,,56.1,12:47:00 PM,Clear,,,,,723,2024-07-25 12:43:00,100.75218288272511,95.64651194026122
7/25/2024 11:46:36,Abdou Bah,2024-07-25,FQ,Lexington Av/63 St,89.2,60.5,"866, 867, 868, 869, 870",Light,11:40:00 PM,89.7,,55.5,11:46:00 AM,Clear,,,89.6,57.1,B08,2024-07-25 23:40:00,98.07130621570028,96.60946859232516
7/25/2024 12:10:48,Abdou Bah,2024-07-25,S,Times Sq-42 St (S),93.3,55.7,"871, 872, 873, 874, 875, 876, 877, 878",Medium,12:06:00 PM,92.5,,47.6,12:10:00 PM,Clear,,,,,902,2024-07-25 12:06:00,105.05967608742114,98.26627789630007
7/25/2024 13:56:54,Abdou Bah,2024-07-25,23,"Wall St (2, 3)",90.9,55.4,"912, 913, 914, 915, 916, 917",Light,1:53:00 PM,91.4,,50.7,1:56:00 PM,Overcast,,,,,230,2024-07-25 13:53:00,99.16474072993613,97.68460202850434
7/25/2024 13:40:57,Abdou Bah,2024-07-25,1,WTC Cortlandt (1),86.5,53.0,"907, 908, 909, 910, 911",Light,1:38:00 PM,86.3,,53.1,1:40:00 PM,Overcast,,,,,138,2024-07-25 13:38:00,89.58244663000008,89.2866209726291
3/3/2025 12:59:44,Abdoul M Nan,2025-03-03,6,E 149 St,58.6,14.7,,Light,12:52:00 PM,49.0,,13.2,12:54:00 PM,Clear,,,,,615,2025-03-03 12:52:00,58.6,49.0
3/3/2025 13:14:39,Abdoul M Nan,2025-03-03,6,Hunts Point Av,62.7,17.8,,Light,1:07:00 PM,51.1,,15.2,1:10:00 PM,Clear,,,,,613,2025-03-03 13:07:00,62.7,51.1
3/3/2025 13:22:40,Abdoul M Nan,2025-03-03,6,Longwood Av,57.1,21.2,,Light,1:18:00 PM,48.2,,18.8,1:22:00 PM,Clear,,,,,614,2025-03-03 13:18:00,57.1,48.2
3/3/2025 13:28:59,Abdoul M Nan,2025-03-03,6,E 143 St-St Mary's St,53.4,14.8,,Light,1:27:00 PM,47.6,,22.3,1:31:00 PM,Clear,,,,,616,2025-03-03 13:27:00,53.4,47.6
3/3/2025 13:40:28,Abdoul M Nan,2025-03-03,6,Cypress Av,54.6,35.2,,Light,1:37:00 PM,50.1,,19.4,1:40:00 PM,Clear,,,,,617,2025-03-03 13:37:00,54.6,50.1
3/3/2025 13:45:42,Abdoul M Nan,2025-03-03,6,Brook Av,53.6,31.8,,Light,1:43:00 PM,44.4,,16.7,1:46:00 PM,Clear,,,,,618,2025-03-03 13:43:00,53.6,44.4
3/3/2025 13:53:42,Abdoul M Nan,2025-03-03,6,3 Av-138 St,50.3,23.0,,Light,1:48:00 PM,46.1,,15.3,1:52:00 PM,Clear,,,54.3,24.1,619,2025-03-03 13:48:00,50.3,46.1
3/3/2025 14:16:11,Abdoul M Nan,2025-03-03,45,138 St-Grand Concourse,53.2,21.0,,Light,2:16:00 PM,45.4,,17.4,2:13:00 PM,Clear,,,51.3,19.3,416,2025-03-03 14:16:00,53.2,45.4
3/3/2025 14:26:54,Abdoul M Nan,2025-03-03,25,149 St-Grand Concourse,52.3,20.3,,Heavy,2:25:00 PM,49.3,,19.8,2:22:00 PM,Clear,,,52.3,18.4,222,2025-03-03 14:25:00,52.3,49.3
3/3/2025 14:33:22,Abdoul M Nan,2025-03-03,25,3 Av-149 St,57.8,24.0,,Heavy,2:30:00 PM,50.9,,22.4,2:32:00 PM,Clear,,,,,221,2025-03-03 14:30:00,57.8,50.9
3/3/2025 15:47:36,Abdoul M Nan,2025-03-03,6,E 149 St,61.7,10.2,,Light,3:46:00 PM,59.6,,19.8,3:49:00 AM,Clear,,,,,615,2025-03-03 15:46:00,61.7,59.6
3/3/2025 15:58:29,Abdoul M Nan,2025-03-03,6,Hunts Point Av,65.4,23.4,,Medium,3:55:00 PM,60.7,,22.4,3:58:00 PM,Clear,,,,,613,2025-03-03 15:55:00,65.4,60.7
3/3/2025 16:01:55,Abdoul M Nan,2025-03-03,6,Longwood Av,61.3,16.8,,Light,4:00:00 PM,58.9,,14.9,4:03:00 PM,Clear,,,,,614,2025-03-03 16:00:00,61.3,58.9
3/3/2025 16:07:25,Abdoul M Nan,2025-03-03,6,E 143 St-St Mary's St,56.8,15.7,,Light,4:05:00 PM,55.6,,13.1,4:07:00 PM,Clear,,,,,616,2025-03-03 16:05:00,56.8,55.6
3/3/2025 16:12:51,Abdoul M Nan,2025-03-03,6,Cypress Av,59.6,26.0,,Light,4:09:00 PM,57.7,,24.3,4:13:00 PM,Clear,,,,,617,2025-03-03 16:09:00,59.6,57.7
3/3/2025 16:17:33,Abdoul M Nan,2025-03-03,6,Brook Av,56.7,18.2,,Medium,4:14:00 AM,55.1,,16.4,4:17:00 AM,Clear,,,,,618,2025-03-03 04:14:00,56.7,55.1
3/3/2025 16:22:11,Abdoul M Nan,2025-03-03,6,3 Av-138 St,54.4,20.1,,Medium,4:18:00 AM,55.3,,20.2,4:22:00 PM,Clear,,,57.2,20.6,619,2025-03-03 04:18:00,54.4,55.3
3/3/2025 16:36:47,Abdoul M Nan,2025-03-03,45,149 St-Grand Concourse,63.1,26.8,,Heavy,4:32:00 PM,60.0,,25.1,4:36:00 PM,Clear,,,,,222,2025-03-03 16:32:00,63.1,60.0
3/10/2025 21:10:56,Abdoul M Nana,2025-03-10,6,Hunts Point Av,66.1,26.8,,Light,1:49:00 PM,68.1,,24.0,1:52:00 PM,Clear,,,68,24.6,613,2025-03-10 13:49:00,66.1,68.1
3/10/2025 21:13:15,Abdoul M Nana,2025-03-10,6,Longwood Av,69.3,26.7,,Light,2:00:00 PM,69.4,,25.3,2:04:00 PM,Clear,,,,,614,2025-03-10 14:00:00,69.3,69.4
3/10/2025 21:15:50,Abdoul M Nana,2025-03-10,6,E 149 St,67.2,29.2,,Light,2:08:00 PM,68.8,,26.7,2:12:00 PM,Clear,,,,,615,2025-03-10 14:08:00,67.2,68.8
3/10/2025 21:17:28,Abdoul M Nana,2025-03-10,6,E 143 St-St Mary's St,68.7,25.8,,Light,2:16:00 PM,69.1,,25.7,2:20:00 PM,Clear,,,,,616,2025-03-10 14:16:00,68.7,69.1
3/10/2025 21:19:37,Abdoul M Nana,2025-03-10,6,Cypress Av,67.3,29.4,,Light,2:23:00 PM,68.7,,27.3,2:26:00 PM,Clear,,,,,617,2025-03-10 14:23:00,67.3,68.7
3/10/2025 21:23:15,Abdoul M Nana,2025-03-10,6,Brook Av,69.8,27.5,,Light,2:30:00 PM,70.6,,25.3,2:33:00 PM,Clear,,,,,618,2025-03-10 14:30:00,69.8,70.6
3/10/2025 21:27:30,Abdoul M Nana,2025-03-10,6,3 Av-138 St,68.2,30.0,,Medium,2:26:00 PM,70.6,,25.3,2:28:00 PM,Clear,,,,,619,2025-03-10 14:26:00,68.2,70.6
3/10/2025 21:31:42,Abdoul M Nana,2025-03-10,456,149 St-Grand Concourse,71.3,25.0,,Heavy,2:34:00 PM,70.8,,24.1,2:38:00 PM,Clear,,,,,222,2025-03-10 14:34:00,71.3,70.8
3/10/2025 21:34:14,Abdoul M Nana,2025-03-10,25,149 St-Grand Concourse,71.8,26.1,,Heavy,2:41:00 PM,70.8,,24.1,2:38:00 PM,Clear,,,,,222,2025-03-10 14:41:00,71.8,70.8
3/10/2025 21:37:09,Abdoul M Nana,2025-03-10,45,138 St-Grand Concourse,71.7,24.6,,Medium,2:46:00 PM,72.4,,24.3,2:50:00 PM,Clear,,,,,416,2025-03-10 14:46:00,71.7,72.4
3/10/2025 21:39:10,Abdoul M Nana,2025-03-10,25,3 Av-149 St,71.2,23.1,,Heavy,2:55:00 PM,72.1,,23.9,3:01:00 PM,Clear,,,,,221,2025-03-10 14:55:00,71.2,72.1
3/10/2025 22:23:50,Abdoul M Nana,2025-03-10,6,Hunts Point Av,78.5,16.3,,Heavy,4:00:00 PM,79.9,,15.5,4:04:00 PM,Clear,,,,,613,2025-03-10 16:00:00,78.5,79.9
3/10/2025 22:27:05,Abdoul M Nana,2025-03-10,6,Longwood Av,71.7,18.9,,Medium,4:08:00 PM,73.6,,16.1,4:11:00 PM,Clear,,,,,614,2025-03-10 16:08:00,71.7,73.6
3/10/2025 22:28:35,Abdoul M Nana,2025-03-10,6,E 149 St,70.3,21.6,,Heavy,4:14:00 PM,73.9,,17.7,4:16:00 PM,Clear,,,,,615,2025-03-10 16:14:00,70.3,73.9
3/10/2025 22:30:04,Abdoul M Nana,2025-03-10,6,E 143 St-St Mary's St,70.6,20.8,,Medium,4:22:00 PM,73.3,,18.7,4:26:00 PM,Clear,,,,,616,2025-03-10 16:22:00,70.6,73.3
3/10/2025 22:32:21,Abdoul M Nana,2025-03-10,6,Cypress Av,70.9,20.1,,Medium,4:30:00 PM,71.2,,19.3,4:33:00 PM,Clear,,,,,617,2025-03-10 16:30:00,70.9,71.2
3/10/2025 22:34:07,Abdoul M Nana,2025-03-10,6,Brook Av,69.4,21.2,,Medium,4:36:00 PM,70.3,,19.9,4:40:00 PM,Clear,,,,,618,2025-03-10 16:36:00,69.4,70.3
3/10/2025 22:35:20,Abdoul M Nana,2025-03-10,6,3 Av-138 St,70.5,20.8,,Heavy,4:45:00 PM,71.7,,18.7,4:49:00 PM,Clear,,,,,619,2025-03-10 16:45:00,70.5,71.7
3/10/2025 22:37:17,Abdoul M Nana,2025-03-10,45,149 St-Grand Concourse,69.2,22.1,,Heavy,4:53:00 PM,70.9,,21.6,4:58:00 PM,Clear,,,,,222,2025-03-10 16:53:00,69.2,70.9
3/10/2025 22:41:14,Abdoul M Nana,2025-03-10,25,149 St-Grand Concourse,69.8,22.6,,Heavy,4:55:00 PM,70.9,,21.6,4:56:00 PM,Clear,,,,,222,2025-03-10 16:55:00,69.8,70.9
3/10/2025 22:42:49,Abdoul M Nana,2025-03-10,45,138 St-Grand Concourse,71.3,20.7,,Heavy,5:02:00 PM,72.1,,19.8,5:06:00 PM,Clear,,,,,416,2025-03-10 17:02:00,71.3,72.1
3/10/2025 22:45:47,Abdoul M Nana,2025-03-10,6,3 Av-149 St,69.1,23.6,,Heavy,5:09:00 PM,70.6,,22.3,5:15:00 PM,Clear,,,,,221,2025-03-10 17:09:00,69.1,70.6
3/3/2025 10:30:00,Alexander Abreu Ramirez,2025-03-03,L,8 Av,69.6,24.7,,Light,10:23:00 AM,65.5,,46.3,10:27:00 AM,Clear,,,66.1,14.8,L01,2025-03-03 10:23:00,69.6,65.5
3/3/2025 10:43:10,Alexander Abreu Ramirez,2025-03-03,L,6 Av,63.7,32.8,,Light,10:34:00 AM,43.3,,16.8,10:38:00 AM,Clear,,,55.4,75.4,L02,2025-03-03 10:34:00,63.7,43.3
3/3/2025 10:59:35,Alexander Abreu Ramirez,2025-03-03,L,14 St-Union Sq,67.7,32.4,,Light,10:51:00 AM,55.7,,19.9,10:57:00 AM,Clear,,,67.5,62.4,L03,2025-03-03 10:51:00,67.7,55.7
3/3/2025 11:12:04,Alexander Abreu Ramirez,2025-03-03,L,3 Av,69.4,65.9,,Light,11:08:00 AM,63.0,,22.0,11:11:00 AM,Clear,,,,,L05,2025-03-03 11:08:00,69.4,63.0
3/3/2025 11:24:01,Alexander Abreu Ramirez,2025-03-03,L,1 Av,65.7,52.3,,Light,11:17:00 AM,43.0,,14.3,11:22:00 AM,Clear,,,61.1,24.3,L06,2025-03-03 11:17:00,65.7,43.0
3/3/2025 11:38:05,Alexander Abreu Ramirez,2025-03-03,L,Bedford Av,63.0,48.1,,Light,11:31:00 AM,52.0,,15.3,11:36:00 AM,Clear,,,61.8,25.9,L08,2025-03-03 11:31:00,63.0,52.0
3/3/2025 11:53:53,Alexander Abreu Ramirez,2025-03-03,L,Lorimer St,57.4,28.8,,Light,11:42:00 AM,52.0,,24.8,11:50:00 AM,Clear,,,60,75.9,L10,2025-03-03 11:42:00,57.4,52.0
3/3/2025 12:04:23,Alexander Abreu Ramirez,2025-03-03,L,Graham Av,58.0,43.3,,Light,12:00:00 PM,51.7,,22.0,12:04:00 PM,Clear,,,,,L11,2025-03-03 12:00:00,58.0,51.7
3/3/2025 12:11:04,Alexander Abreu Ramirez,2025-03-03,L,Grand St,56.6,23.8,,Light,12:08:00 PM,48.7,,20.1,12:10:00 PM,Clear,,,,,L12,2025-03-03 12:08:00,56.6,48.7
3/3/2025 12:42:25,Alexander Abreu Ramirez,2025-03-03,L,8 Av,70.6,22.0,,Light,12:33:00 PM,47.0,,8.2,12:39:00 PM,Clear,,,68.2,18.9,L01,2025-03-03 12:33:00,70.6,47.0
3/3/2025 12:49:59,Alexander Abreu Ramirez,2025-03-03,L,6 Av,64.2,17.3,,Light,12:45:00 PM,53.9,,10.6,12:49:00 PM,Clear,,,66.3,27.4,L02,2025-03-03 12:45:00,64.2,53.9
3/3/2025 13:02:59,Alexander Abreu Ramirez,2025-03-03,L,14 St-Union Sq,66.8,24.0,,Medium,12:57:00 PM,46.8,,15.5,1:02:00 PM,Clear,,,64.5,22.7,L03,2025-03-03 12:57:00,66.8,46.8
3/3/2025 13:16:51,Alexander Abreu Ramirez,2025-03-03,L,3 Av,59.6,18.1,,Light,1:12:00 PM,55.2,,25.2,1:16:00 PM,Clear,,,,,L05,2025-03-03 13:12:00,59.6,55.2
3/3/2025 13:30:04,Alexander Abreu Ramirez,2025-03-03,L,1 Av,61.7,19.0,,Light,1:24:00 PM,58.0,,21.0,1:28:00 PM,Clear,,,60.8,44.4,L06,2025-03-03 13:24:00,61.7,58.0
3/3/2025 13:43:10,Alexander Abreu Ramirez,2025-03-03,L,Bedford Av,62.4,23.9,,Medium,1:38:00 PM,49.9,,19.5,1:42:00 PM,Clear,,,61.8,25,L08,2025-03-03 13:38:00,62.4,49.9
3/3/2025 13:55:35,Alexander Abreu Ramirez,2025-03-03,L,Lorimer St,57.1,30.1,,Light,1:47:00 PM,45.9,,19.3,1:52:00 PM,Clear,,,51.3,16.6,L10,2025-03-03 13:47:00,57.1,45.9
3/3/2025 14:04:12,Alexander Abreu Ramirez,2025-03-03,L,Graham Av,58.4,20.0,,Light,2:01:00 PM,44.6,,19.1,2:03:00 PM,Clear,,,,,L11,2025-03-03 14:01:00,58.4,44.6
3/3/2025 14:17:26,Alexander Abreu Ramirez,2025-03-03,L,Grand St,57.3,25.3,,Light,2:14:00 PM,52.5,,19.2,2:16:00 PM,Clear,,,,,L12,2025-03-03 14:14:00,57.3,52.5
3/10/2025 10:48:54,Alexander Abreu Ramirez,2025-03-10,L,8 Av,73.4,28.3,,Light,10:44:00 AM,67.3,,27.8,10:46:00 AM,Clear,,,70.3,27.5,L01,2025-03-10 10:44:00,73.4,67.3
3/10/2025 10:57:00,Alexander Abreu Ramirez,2025-03-10,L,6 Av,76.5,37.8,,Light,10:53:00 AM,71.1,,25.7,10:56:00 AM,Clear,,,74,26.6,L02,2025-03-10 10:53:00,76.5,71.1
3/10/2025 11:10:39,Alexander Abreu Ramirez,2025-03-10,L,14 St-Union Sq,77.3,28.1,,Medium,11:06:00 AM,71.3,,23.9,11:10:00 AM,Clear,,,66.9,26.2,L03,2025-03-10 11:06:00,77.3,71.3
3/10/2025 11:21:44,Alexander Abreu Ramirez,2025-03-10,L,3 Av,76.6,26.1,,Light,11:16:00 AM,75.5,,29.0,11:21:00 AM,Clear,,,,,L05,2025-03-10 11:16:00,76.6,75.5
3/10/2025 11:32:10,Alexander Abreu Ramirez,2025-03-10,L,1 Av,75.9,27.4,,Light,11:28:00 AM,69.9,,25.3,11:31:00 AM,Clear,,,77.5,45.5,L06,2025-03-10 11:28:00,75.9,69.9
3/10/2025 11:43:37,Alexander Abreu Ramirez,2025-03-10,L,Bedford Av,75.4,43.9,,Light,11:39:00 AM,68.8,,24.3,11:43:00 AM,Clear,,,71.2,24.6,L08,2025-03-10 11:39:00,75.4,68.8
3/10/2025 11:56:12,Alexander Abreu Ramirez,2025-03-10,L,Lorimer St,73.4,26.7,,Light,11:51:00 AM,71.0,,22.6,11:54:00 AM,Clear,,,68,21.9,L10,2025-03-10 11:51:00,73.4,71.0
3/10/2025 12:07:59,Alexander Abreu Ramirez,2025-03-10,L,Graham Av,72.5,30.0,,Light,12:03:00 PM,67.3,,25.8,12:05:00 PM,Clear,,,,,L11,2025-03-10 12:03:00,72.5,67.3
3/10/2025 12:17:15,Alexander Abreu Ramirez,2025-03-10,L,Grand St,70.8,25.9,,Light,12:13:00 AM,68.6,,25.0,12:15:00 PM,Clear,,,,,L12,2025-03-10 00:13:00,70.8,68.6
3/10/2025 12:48:46,Alexander Abreu Ramirez,2025-03-10,L,8 Av,75.7,29.3,,Light,12:44:00 PM,69.7,,24.9,12:46:00 PM,Clear,,,70.7,24.5,L01,2025-03-10 12:44:00,75.7,69.7
3/10/2025 13:01:22,Alexander Abreu Ramirez,2025-03-10,L,6 Av,76.4,29.5,,Light,12:58:00 PM,69.9,,25.5,1:00:00 PM,Clear,,,71.4,27.8,L02,2025-03-10 12:58:00,76.4,69.9
3/10/2025 13:10:51,Alexander Abreu Ramirez,2025-03-10,L,14 St-Union Sq,71.0,30.3,,Medium,1:05:00 PM,67.3,,24.8,1:10:00 PM,Clear,,,70.3,27.5,L03,2025-03-10 13:05:00,71.0,67.3
3/10/2025 13:21:02,Alexander Abreu Ramirez,2025-03-10,L,3 Av,72.4,30.1,,Light,1:17:00 PM,70.2,,24.8,1:20:00 PM,Clear,,,,,L05,2025-03-10 13:17:00,72.4,70.2
3/10/2025 13:28:39,Alexander Abreu Ramirez,2025-03-10,L,1 Av,70.9,29.1,,Light,1:24:00 PM,67.9,,22.0,1:28:00 PM,Clear,,,74,29.3,L06,2025-03-10 13:24:00,70.9,67.9
3/10/2025 13:41:56,Alexander Abreu Ramirez,2025-03-10,L,Bedford Av,74.0,29.2,,Medium,1:37:00 PM,67.6,,23.0,1:40:00 PM,Clear,,,69.4,24.8,L08,2025-03-10 13:37:00,74.0,67.6
3/10/2025 13:53:45,Alexander Abreu Ramirez,2025-03-10,L,Lorimer St,72.1,32.4,,Light,1:48:00 PM,63.5,,20.1,1:53:00 PM,Clear,,,67.3,19.7,L10,2025-03-10 13:48:00,72.1,63.5
3/10/2025 14:05:59,Alexander Abreu Ramirez,2025-03-10,L,Graham Av,71.0,25.8,,Light,2:02:00 PM,66.5,,21.2,2:05:00 PM,Clear,,,,,L11,2025-03-10 14:02:00,71.0,66.5
3/10/2025 14:12:11,Alexander Abreu Ramirez,2025-03-10,L,Grand St,66.1,29.1,,Light,2:09:00 PM,67.6,,24.5,2:11:00 AM,Clear,,,,,L12,2025-03-10 14:09:00,66.1,67.6
3/17/2025 10:38:16,Alexander Abreu Ramirez,2025-03-17,L,8 Av,79.8,57.8,,Light,10:32:00 AM,62.2,,54.0,10:34:00 AM,Overcast,Light,Rain has stopped currently but today is a cloudy day with no sun. Itâ€™ll be interesting to see how this affects results.,74.5,68.2,L01,2025-03-17 10:32:00,79.8,62.2
3/17/2025 10:48:40,Alexander Abreu Ramirez,2025-03-17,L,6 Av,76.9,51.1,,Light,10:44:00 AM,66.6,,51.1,10:48:00 AM,Overcast,,,73.6,50.8,L02,2025-03-17 10:44:00,76.9,66.6
3/17/2025 10:56:27,Alexander Abreu Ramirez,2025-03-17,L,14 St-Union Sq,74.7,57.4,,Light,10:52:00 AM,73.4,,55.7,10:55:00 AM,Overcast,,,72,57.1,L03,2025-03-17 10:52:00,74.7,73.4
3/17/2025 11:08:08,Alexander Abreu Ramirez,2025-03-17,L,3 Av,79.2,69.0,,Light,11:04:00 AM,75.0,,46.8,11:07:00 AM,Overcast,Light,Light rain has no started up again.,,,L05,2025-03-17 11:04:00,79.2,75.0
3/17/2025 11:15:48,Alexander Abreu Ramirez,2025-03-17,L,1 Av,75.7,64.4,,Light,11:12:00 AM,71.4,,52.3,11:14:00 AM,Overcast,,Light rain has stopped again.,70,52.1,L06,2025-03-17 11:12:00,75.7,71.4
3/17/2025 11:36:57,Alexander Abreu Ramirez,2025-03-17,L,Lorimer St,75.2,53.6,,Light,11:32:00 AM,69.7,,53.3,11:36:00 AM,Overcast,Light,Light drizzling at this station.,,,L10,2025-03-17 11:32:00,75.2,69.7
3/17/2025 11:55:52,Alexander Abreu Ramirez,2025-03-17,L,Graham Av,72.8,57.0,,Light,11:46:00 AM,73.2,,51.9,11:52:00 AM,Overcast,Light,Light rain with occasional wind has started now. The temperature and humidity are constantly jumping at street level.,,,L11,2025-03-17 11:46:00,72.8,73.2
3/17/2025 12:02:08,Alexander Abreu Ramirez,2025-03-17,L,Grand St,72.6,51.7,,Light,11:57:00 AM,66.8,,58.6,12:01:00 PM,Overcast,Light,"Light rain with wind continues, causing street temperatures to jump still.",,,L12,2025-03-17 11:57:00,72.6,66.8
3/17/2025 12:40:13,Alexander Abreu Ramirez,2025-03-17,L,8 Av,78.6,57.6,,Light,12:35:00 PM,78.1,,39.4,12:38:00 PM,Overcast,,Rain has stopped again.,74.6,49.6,L01,2025-03-17 12:35:00,78.6,78.1
3/17/2025 12:49:13,Alexander Abreu Ramirez,2025-03-17,L,6 Av,77.3,50.0,,Light,12:46:00 PM,71.0,,47.1,12:48:00 PM,Overcast,,,75.6,49.8,L02,2025-03-17 12:46:00,77.3,71.0
3/17/2025 13:02:30,Alexander Abreu Ramirez,2025-03-17,L,14 St-Union Sq,74.8,53.6,,Medium,12:58:00 PM,68.8,,50.6,1:02:00 PM,Overcast,,,72.9,51.3,L03,2025-03-17 12:58:00,74.8,68.8
3/17/2025 13:11:36,Alexander Abreu Ramirez,2025-03-17,L,3 Av,74.5,48.8,,Light,1:07:00 PM,63.7,I ,47.5,1:10:00 PM,Overcast,,Light wind conditions but not enough to make temperatures jump.,,,L05,2025-03-17 13:07:00,74.5,63.7
3/17/2025 13:16:48,Alexander Abreu Ramirez,2025-03-17,L,1 Av,73.0,56.8,,Light,1:15:00 PM,66.0,,51.9,1:16:00 PM,Overcast,,,68.9,54.1,L06,2025-03-17 13:15:00,73.0,66.0
3/17/2025 13:26:10,Alexander Abreu Ramirez,2025-03-17,L,Bedford Av,70.0,57.7,,Light,1:22:00 PM,68.2,,51.6,1:25:00 PM,Overcast,,,67.5,53.6,L08,2025-03-17 13:22:00,70.0,68.2
3/17/2025 13:37:01,Alexander Abreu Ramirez,2025-03-17,L,Lorimer St,72.6,54.1,,Light,1:33:00 PM,71.6,,44.2,1:36:00 PM,Overcast,,,71.3,53.5,L10,2025-03-17 13:33:00,72.6,71.6
3/17/2025 13:48:17,Alexander Abreu Ramirez,2025-03-17,L,Graham Av,69.2,50.1,,Light,1:45:00 PM,64.3,,48.0,1:46:00 PM,Overcast,,,,,L11,2025-03-17 13:45:00,69.2,64.3
3/17/2025 13:55:33,Alexander Abreu Ramirez,2025-03-17,L,Grand St,71.7,53.8,,Light,1:51:00 PM,67.7,,48.3,1:55:00 PM,Overcast,,Light wind conditions at street level.,,,L12,2025-03-17 13:51:00,71.7,67.7
7/1/2024 14:20:36,Cesar Pascal Vasquez,2024-07-01,BD,161 St-Yankee Stadium,82.0,47.3,N/a,Medium,2:20:00 PM,81.9,,51.6,2:16:00 PM,Clear,,,,,D11,2024-07-01 14:20:00,82.37869196289998,82.89769636943609
7/1/2024 12:08:36,Cesar Pascal Vasquez,2024-07-01,BD,163 St-Amsterdam Av,82.6,43.9,N/a,Light,12:00:00 PM,83.6,,48.7,12:02:00 PM,Clear,,161,,,A10,2024-07-01 12:00:00,82.49345399397603,84.3717777996841
7/1/2024 12:18:31,Cesar Pascal Vasquez,2024-07-01,BD,167 St,81.1,51.7,N/a,Light,12:14:00 PM,78.9,,49.0,12:18:00 PM,Clear,,,,,D10,2024-07-01 12:14:00,82.04739635922898,78.9
7/1/2024 14:28:07,Cesar Pascal Vasquez,2024-07-01,BD,167 St,80.5,49.9,N/a,Light,2:24:00 PM,78.8,,42.8,2:28:00 PM,Clear,,,,,D10,2024-07-01 14:24:00,81.246203558925,78.8
7/1/2024 12:31:03,Cesar Pascal Vasquez,2024-07-01,BD,170 St,80.8,52.1,N/a,Light,12:24:00 PM,80.4,,50.2,12:28:00 PM,Clear,,,,,D09,2024-07-01 12:24:00,81.78746458704416,81.18501621926401
7/1/2024 14:41:40,Cesar Pascal Vasquez,2024-07-01,BD,170 St,84.0,46.3,N/a,Light,2:41:00 PM,83.5,,46.6,2:37:00 PM,Clear,,,,,D09,2024-07-01 14:41:00,84.38430875730005,83.86733840759996
7/1/2024 12:45:08,Cesar Pascal Vasquez,2024-07-01,BD,174-175 Sts,83.0,45.5,N/a,Light,12:44:00 PM,82.4,,43.7,12:42:00 PM,Clear,,,,,D08,2024-07-01 12:44:00,83.13832781499994,82.273104951844
7/1/2024 14:49:21,Cesar Pascal Vasquez,2024-07-01,BD,174-175 Sts,82.5,41.1,N/a,Light,2:49:00 PM,81.8,,40.0,2:46:00 PM,Clear,,,,,D08,2024-07-01 14:49:00,82.0219075159251,81.28690442879989
7/1/2024 13:05:33,Cesar Pascal Vasquez,2024-07-01,BD,182-183 Sts,85.6,42.9,N/a,Light,1:05:00 PM,85.8,,43.2,1:02:00 PM,Clear,,,,,D06,2024-07-01 13:05:00,85.58388256835597,85.89340414649598
7/1/2024 15:07:37,Cesar Pascal Vasquez,2024-07-01,BD,182-183 Sts,84.0,45.1,N/a,Light,3:07:00 PM,83.6,,38.5,3:04:00 PM,Clear,,,,,D06,2024-07-01 15:07:00,84.15894857970014,82.68321059970013
7/1/2024 13:31:02,Cesar Pascal Vasquez,2024-07-01,BD,Bedford Park Blvd,79.1,57.2,N/a,Light,1:28:00 PM,79.9,,46.5,1:30:00 PM,Clear,,,,,D03,2024-07-01 13:28:00,79.1,79.9
7/1/2024 15:46:24,Cesar Pascal Vasquez,2024-07-01,BD,Bedford Park Blvd,83.0,43.5,N/a,Light,3:46:00 PM,81.0,,40.3,3:43:00 PM,Clear,,,,,D03,2024-07-01 15:46:00,82.82959877500006,80.68125193739999
7/1/2024 15:21:16,Cesar Pascal Vasquez,2024-07-01,BD,Fordham Rd,81.8,44.8,N/a,Light,3:21:00 PM,78.1,,39.6,3:17:00 PM,Clear,,,,,D05,2024-07-01 15:21:00,81.85417872921597,78.1
7/1/2024 15:36:43,Cesar Pascal Vasquez,2024-07-01,BD,Kingsbridge Rd,81.6,43.3,N/a,Light,3:35:00 PM,80.9,,40.4,3:32:00 PM,Clear,,,,,D04,2024-07-01 15:35:00,81.49230649808393,80.61448245943596
7/1/2024 15:56:40,Cesar Pascal Vasquez,2024-07-01,BD,Norwood- 205 St,85.2,54.2,N/a,Light,3:56:00 PM,81.2,,46.5,3:53:00 PM,Clear,,,,,D01,2024-07-01 15:56:00,87.86141330233605,81.50955816610005
7/1/2024 13:39:50,Cesar Pascal Vasquez,2024-07-01,BD,Norwood-205 St,83.0,59.7,N/a,Light,1:36:00 PM,83.5,,47.5,1:39:00 PM,Clear,,,,,D01,2024-07-01 13:36:00,85.84968371019988,84.02963537812491
7/1/2024 12:54:03,Cesar Pascal Vasquez,2024-07-01,BD,Tremont Av,81.0,47.1,N/a,Light,12:53:00 PM,81.0,,41.0,12:50:00 PM,Clear,,,,,D07,2024-07-01 12:53:00,81.39668649260001,80.74975486000014
7/1/2024 15:00:02,Cesar Pascal Vasquez,2024-07-01,BD,Tremont Av,83.2,44.6,N/a,Light,2:59:00 PM,79.6,,39.7,2:57:00 PM,Clear,,,,,D07,2024-07-01 14:59:00,83.20417275558407,79.6
7/2/2024 14:51:01,Cesar Pascal Vasquez,2024-07-02,BD,161 St-Yankee Stadium,86.4,41.7,0063-0066,Medium,2:41:00 PM,84.9,,23.0,2:50:00 PM,Clear,,,,,D11,2024-07-02 14:41:00,86.290019028644,82.13340086679999
7/2/2024 16:56:26,Cesar Pascal Vasquez,2024-07-02,BD,161 St-Yankee Stadium,86.4,48.9,0070-0072,Medium,4:54:00 PM,86.2,,47.2,4:56:00 PM,Clear,,,,,D11,2024-07-02 16:54:00,88.16471330435598,87.40351385577608
7/2/2024 14:31:00,Cesar Pascal Vasquez,2024-07-02,BD,167 St,84.7,42.3,N/a,Medium,2:30:00 PM,84.4,,34.6,2:28:00 PM,Clear,,,,,D10,2024-07-02 14:30:00,84.42153713350099,82.88843254569602
7/2/2024 16:44:48,Cesar Pascal Vasquez,2024-07-02,BD,167 St,85.3,46.0,N/a,Medium,4:41:00 PM,85.1,85.1,33.2,4:44:00 PM,Clear,,,,,D10,2024-07-02 16:41:00,85.90473612029997,83.3453074402839
7/2/2024 14:21:48,Cesar Pascal Vasquez,2024-07-02,BD,170 St,86.5,39.2,N/a,Medium,2:21:00 PM,86.0,,28.4,2:19:00 PM,Clear,,,,,D09,2024-07-02 14:21:00,85.8529665943,83.5549512736
7/2/2024 14:08:54,Cesar Pascal Vasquez,2024-07-02,BD,174-175 Sts,84.0,31.0,N/a,Light,2:04:00 PM,83.7,,34.5,2:08:00 PM,Clear,,,,,D08,2024-07-02 14:04:00,82.11032268000011,82.25322373872505
7/2/2024 16:28:32,Cesar Pascal Vasquez,2024-07-02,BD,174-175 Sts,86.1,48.7,N/a,Medium,4:26:00 PM,85.7,,41.6,4:28:00 PM,Clear,,,,,D08,2024-07-02 16:26:00,87.67060634550899,85.42511263884396
7/2/2024 13:53:11,Cesar Pascal Vasquez,2024-07-02,BD,182-183 Sts,86.0,51.2,N/a,Light,1:52:00 PM,83.6,,31.0,1:51:00 PM,Clear,,,,,D06,2024-07-02 13:52:00,88.23325878639986,81.78285779520016
7/2/2024 16:07:18,Cesar Pascal Vasquez,2024-07-02,BD,182-183 Sts,84.3,49.3,N/a,Medium,4:04:00 PM,84.8,,31.6,4:07:00 PM,Clear,,,,,D06,2024-07-02 16:04:00,85.36419961262115,82.8652980085439
7/2/2024 13:22:15,Cesar Pascal Vasquez,2024-07-02,BD,Bedford Park Blvd,82.9,34.3,N/a,Light,1:22:00 PM,84.0,84.4,31.3,1:18:00 PM,Clear,,,,,D03,2024-07-02 13:22:00,81.56084479014912,82.14240842729998
7/2/2024 15:37:47,Cesar Pascal Vasquez,2024-07-02,BD,Bedford Park Blvd,85.0,44.0,N/a,Medium,3:37:00 PM,85.3,,35.4,3:35:00 PM,Clear,,,,,D03,2024-07-02 15:37:00,85.10045536,83.86039133854402
7/3/2024 11:24:13,Cesar Pascal Vasquez,2024-07-02,BD,Bedford Park Blvd,83.4,45.6,N/a,Light,10:14:00 AM,82.1,,31.2,10:15:00 AM,Clear,,,,,D03,2024-07-02 10:14:00,83.58248039513596,80.65532727276411
7/2/2024 13:45:18,Cesar Pascal Vasquez,2024-07-02,BD,Fordham Rd,84.2,38.7,N/a,Light,1:44:00 PM,83.8,,38.3,1:42:00 PM,Clear,,,,,D05,2024-07-02 13:44:00,83.28718277989609,82.84275467173615
7/2/2024 15:54:55,Cesar Pascal Vasquez,2024-07-02,BD,Fordham Rd,83.3,38.6,N/a,Medium,3:52:00 PM,83.8,,32.2,3:54:00 PM,Clear,,,,,D05,2024-07-02 15:52:00,82.419972159664,82.07334696585603
7/2/2024 13:34:52,Cesar Pascal Vasquez,2024-07-02,BD,Kingsbridge Rd,86.1,47.0,N/a,Light,1:34:00 PM,84.9,,38.7,1:31:00 PM,Clear,,,,,D04,2024-07-02 13:34:00,87.21153553240003,83.99352553406915
7/2/2024 15:48:40,Cesar Pascal Vasquez,2024-07-02,BD,Kingsbridge Rd,85.1,42.5,N/a,Medium,3:45:00 PM,82.9,,35.4,3:48:00 PM,Clear,,,,,D04,2024-07-02 15:45:00,84.91237141232503,81.68100553169596
7/2/2024 13:08:59,Cesar Pascal Vasquez,2024-07-02,BD,Norwood- 205 St,84.6,42.8,0060-0062,Light,1:05:00 PM,84.0,,32.7,1:02:00 PM,Clear,,,,,D01,2024-07-02 13:05:00,84.40393341654399,82.29875419730003
7/2/2024 15:26:42,Cesar Pascal Vasquez,2024-07-02,BD,Norwood- 205 St,84.8,60.2,0067-0069,Medium,3:23:00 PM,83.9,,32.1,3:26:00 PM,Clear,,,,,D01,2024-07-02 15:23:00,88.95703798057579,82.14609806118096
7/2/2024 14:03:17,Cesar Pascal Vasquez,2024-07-02,BD,Tremont Av,84.2,38.2,N/a,Light,2:02:00 PM,83.4,,31.2,1:59:00 PM,Clear,,,,,D07,2024-07-02 14:02:00,83.21124909321594,81.642389896064
7/2/2024 16:17:00,Cesar Pascal Vasquez,2024-07-02,BD,Tremont Av,85.7,45.6,N/a,Medium,4:13:00 PM,83.5,,31.4,4:16:00 PM,Clear,,,,,D07,2024-07-02 16:13:00,86.324662093564,81.74265573160004
7/3/2024 11:55:45,Cesar Pascal Vasquez,2024-07-03,BD,161 St-Yankee Stadium,87.7,44.0,0077-0081,Medium,11:54:00 AM,84.5,,34.7,11:59:00 AM,Clear,,,,,D11,2024-07-03 11:54:00,88.61461890310008,82.99366357652498
7/3/2024 14:15:57,Cesar Pascal Vasquez,2024-07-03,BD,161 St-Yankee Stadium,83.3,44.2,0118-0124,Medium,2:10:00 PM,83.5,,40.0,2:15:00 PM,Clear,,"Not notable wins, high humidity thatâ€™s not expected for the street level",,,D11,2024-07-03 14:10:00,83.24432057025604,82.80182748749993
7/3/2024 11:42:53,Cesar Pascal Vasquez,2024-07-03,BD,167 St,86.1,50.3,N/a,Light,11:31:00 AM,82.1,,37.6,11:36:00 AM,Clear,,,,,D10,2024-07-03 11:31:00,88.12304504998895,81.26970100767608
7/3/2024 13:54:44,Cesar Pascal Vasquez,2024-07-03,BD,167 St,83.8,42.5,0114-0117,Medium,1:53:00 PM,83.0,,34.9,1:55:00 PM,Clear,,,,,D10,2024-07-03 13:53:00,83.48820925180003,81.70788312780007
7/3/2024 11:40:04,Cesar Pascal Vasquez,2024-07-03,BD,170 St,85.2,35.3,N/a,Light,11:16:00 AM,84.2,,32.1,11:18:00 AM,Clear,,,,,D09,2024-07-03 11:16:00,83.74634008987603,82.40088302322404
7/3/2024 13:41:34,Cesar Pascal Vasquez,2024-07-03,BD,170 St,83.6,46.0,0111-0113,Medium,1:39:00 PM,82.5,,34.7,1:41:00 PM,Clear,,,,,D09,2024-07-03 13:39:00,83.87275045920016,81.28320933032509
7/3/2024 11:37:52,Cesar Pascal Vasquez,2024-07-03,BD,174-175 Sts,84.3,46.1,N/a,Light,11:03:00 AM,85.1,85.1,32.0,11:06:00 AM,Clear,,,,,D08,2024-07-03 11:03:00,84.69748578394908,83.1852679099
7/3/2024 13:29:17,Cesar Pascal Vasquez,2024-07-03,BD,174-175 Sts,83.1,39.4,0107-0109,Light,1:28:00 PM,84.4,84.4,33.2,1:29:00 PM,Clear,,,,,D08,2024-07-03 13:28:00,82.34416621857598,82.70763812646396
7/3/2024 11:34:22,Cesar Pascal Vasquez,2024-07-03,BD,182-183 Sts,82.8,43.1,N/a,Light,10:43:00 AM,82.0,,31.0,10:46:00 AM,Clear,,,,,D06,2024-07-03 10:43:00,82.57398049344413,80.56688856000004
7/3/2024 13:10:58,Cesar Pascal Vasquez,2024-07-03,BD,182-183 Sts,82.4,42.7,0100-0102,Medium,1:09:00 PM,83.6,83.6,31.4,1:11:00 PM,Clear,,,,,D06,2024-07-03 13:09:00,82.138844831604,81.82357624489612
7/3/2024 12:39:59,Cesar Pascal Vasquez,2024-07-03,BD,Bedford Park Blvd,85.5,48.1,0087-0089,Medium,12:39:00 PM,83.5,,37.5,12:42:00 PM,Clear,,,,,D03,2024-07-03 12:39:00,86.67208808092505,82.45552125312497
7/3/2024 11:32:45,Cesar Pascal Vasquez,2024-07-03,BD,Fordham Rd,85.1,53.2,N/a,Light,10:34:00 AM,83.8,,35.4,10:37:00 AM,Clear,,,,,D05,2024-07-03 10:34:00,87.43142687708405,82.4521514095041
7/3/2024 13:03:39,Cesar Pascal Vasquez,2024-07-03,BD,Fordham Rd,83.0,42.5,0096-0099,Medium,1:01:00 PM,82.8,,34.3,1:03:00 PM,Clear,,,,,D05,2024-07-03 13:01:00,82.68200759500007,81.48026207283607
7/3/2024 11:26:11,Cesar Pascal Vasquez,2024-07-03,BD,Kingsbridge Rd,84.7,48.3,N/a,Light,10:26:00 AM,83.5,,33.5,10:28:00 AM,Clear,,,,,D04,2024-07-03 10:26:00,85.65841059874097,81.96691286312509
7/3/2024 12:52:22,Cesar Pascal Vasquez,2024-07-03,BD,Kingsbridge Rd,82.9,36.0,0092-0095,Medium,12:51:00 PM,84.0,,28.9,12:53:00 PM,Clear,,,,,D04,2024-07-03 12:51:00,81.7487973767,81.89972492970006
7/3/2024 12:27:05,Cesar Pascal Vasquez,2024-07-03,BD,Norwood- 205 St,80.8,52.7,0083-0086,Light,12:24:00 PM,82.8,,30.6,12:26:00 PM,Clear,,,,,D01,2024-07-03 12:24:00,81.85960751851613,81.11998889494406
7/3/2024 13:19:03,Cesar Pascal Vasquez,2024-07-03,BD,Tremont Av,83.0,42.4,0103-0105,Medium,1:17:00 PM,81.3,,35.8,1:19:00 PM,Clear,,,,,D07,2024-07-03 13:17:00,82.66749683280005,80.48250679953611
7/9/2024 11:11:54,Cesar Pascal Vasquez,2024-07-09,BD,161 St-Yankee Stadium,86.3,65.9,149-150,Medium,11:09:00 AM,87.0,,66.3,11:11:00 AM,Clear,,,,,D11,2024-07-09 11:09:00,94.01607828718902,95.8042370413998
7/9/2024 13:24:28,Cesar Pascal Vasquez,2024-07-09,BD,161 St-Yankee Stadium,88.5,68.2,175-177,Medium,1:18:00 PM,87.1,,69.2,1:23:00 PM,Clear,,"Unusual, higher temperature and humidity at surface ",,,D11,2024-07-09 13:18:00,100.55277384840024,97.43436790908393
7/9/2024 11:01:20,Cesar Pascal Vasquez,2024-07-09,BD,167 St,86.8,64.3,147-148,Light,11:00:00 AM,87.6,,55.7,11:02:00 AM,Clear,,,,,D10,2024-07-09 11:00:00,94.44976157619604,92.50191222888401
7/9/2024 13:09:03,Cesar Pascal Vasquez,2024-07-09,BD,167 St,88.5,68.9,173-174,Light,1:07:00 PM,90.1,,53.4,1:09:00 PM,Clear,,,,,D10,2024-07-09 13:07:00,100.95285251672516,96.39812412593616
7/9/2024 10:55:46,Cesar Pascal Vasquez,2024-07-09,BD,170 St,86.7,64.6,145-146,Light,10:54:00 AM,87.2,,46.9,10:55:00 AM,Clear,,,,,D09,2024-07-09 10:54:00,94.35705006542383,88.75515155600405
7/9/2024 13:03:17,Cesar Pascal Vasquez,2024-07-09,BD,170 St,87.2,64.5,170-172,Light,1:01:00 PM,89.4,,55.9,1:03:00 PM,Clear,,,,,D09,2024-07-09 13:01:00,95.44079268010015,96.17576562645624
7/9/2024 10:49:10,Cesar Pascal Vasquez,2024-07-09,BD,174-175 Sts,87.3,63.7,142-144,Light,10:48:00 AM,86.7,,54.8,10:50:00 AM,Clear,,,,,D08,2024-07-09 10:48:00,95.30239059026096,90.53026803919596
7/9/2024 12:52:40,Cesar Pascal Vasquez,2024-07-09,BD,174-175 Sts,87.1,65.7,168-169,Medium,12:50:00 PM,88.3,,57.6,12:52:00 PM,Clear,,,,,D08,2024-07-09 12:50:00,95.76171508706898,94.68798512308396
7/9/2024 10:33:13,Cesar Pascal Vasquez,2024-07-09,BD,182-183 Sts,89.2,70.2,138-139,Heavy,10:31:00 AM,87.7,,63.0,10:33:00 AM,Clear,,,,,D06,2024-07-09 10:31:00,103.69993342073629,95.88233770520011
7/9/2024 12:31:41,Cesar Pascal Vasquez,2024-07-09,BD,182-183 Sts,86.5,66.9,163-164,Medium,12:30:00 PM,87.3,,60.4,12:32:00 PM,Clear,,,,,D06,2024-07-09 12:30:00,94.90297550832489,93.846420425964
7/9/2024 9:55:52,Cesar Pascal Vasquez,2024-07-09,BD,Bedford Park Blvd,86.7,72.1,130-132,Light,9:53:00 AM,85.2,,64.2,9:55:00 AM,Clear,,,,,D03,2024-07-09 09:53:00,97.82595152814906,91.02060838793582
7/9/2024 12:01:23,Cesar Pascal Vasquez,2024-07-09,BD,Bedford Park Blvd,89.7,72.4,154-156,Light,11:59:00 AM,88.6,,60.4,12:02:00 PM,Clear,,,,,D03,2024-07-09 11:59:00,106.65477823556425,96.65417149161595
7/9/2024 10:20:23,Cesar Pascal Vasquez,2024-07-09,BD,Fordham Rd,87.6,77.1,135-137,Light,10:18:00 AM,88.5,,68.0,10:20:00 AM,Clear,,,,,D05,2024-07-09 10:18:00,103.14256975667602,100.43937847750033
7/9/2024 12:22:54,Cesar Pascal Vasquez,2024-07-09,BD,Fordham Rd,86.1,64.3,169-162,Medium,12:21:00 PM,85.8,,53.7,12:23:00 PM,Clear,,,,,D05,2024-07-09 12:21:00,92.92454606562893,88.66419650117581
7/9/2024 10:11:58,Cesar Pascal Vasquez,2024-07-09,BD,Kingsbridge Rd,86.0,66.1,133-134,Heavy,10:09:00 AM,86.3,,65.4,10:11:00 AM,Clear,,,,,D04,2024-07-09 10:09:00,93.4292540300998,93.80697805950413
7/9/2024 12:10:50,Cesar Pascal Vasquez,2024-07-09,BD,Kingsbridge Rd,86.9,60.3,157-159,Light,12:10:00 PM,85.7,,57.2,12:11:00 PM,Clear,,,,,D04,2024-07-09 12:10:00,92.98279150258867,89.59457772439586
7/9/2024 9:45:23,Cesar Pascal Vasquez,2024-07-09,BD,Norwood- 205 St,82.7,73.0,126-129,Light,9:41:00 AM,85.8,,69.9,9:45:00 AM,Clear,,,,,D01,2024-07-09 09:41:00,88.56719180520017,94.54174691986404
7/9/2024 11:49:44,Cesar Pascal Vasquez,2024-07-09,BD,Norwood- 205 St,87.7,65.0,151-153,Medium,11:47:00 AM,89.8,,61.3,11:49:00 AM,Clear,,,,,D01,2024-07-09 11:47:00,96.84347876680009,99.9346711038963
7/9/2024 10:41:24,Cesar Pascal Vasquez,2024-07-09,BD,Tremont Av,88.8,69.3,140-141,Light,10:39:00 AM,86.6,,55.2,10:41:00 AM,Clear,,,,,D07,2024-07-09 10:39:00,102.01161703427618,90.49484794278408
7/9/2024 12:42:17,Cesar Pascal Vasquez,2024-07-09,BD,Tremont Av,87.6,67.6,165-167,Light,12:41:00 PM,88.5,,55.9,12:43:00 PM,Clear,,,,,D07,2024-07-09 12:41:00,97.89672642873587,94.33370858272525
7/10/2024 11:21:24,Cesar Pascal Vasquez,2024-07-10,BD,161 St-Yankee Stadium,85.6,70.6,199-200,Medium,11:18:00 AM,86.2,,71.5,11:21:00 AM,Clear,,,,,D11,2024-07-10 11:18:00,94.35380037705595,96.23734732860008
7/10/2024 13:17:03,Cesar Pascal Vasquez,2024-07-10,BD,161 St-Yankee Stadium,85.9,69.7,223-226,Medium,1:13:00 PM,87.0,,70.9,1:16:00 PM,Clear,,,,,D11,2024-07-10 13:13:00,94.6970872726292,98.02180344059968
7/10/2024 11:07:05,Cesar Pascal Vasquez,2024-07-10,BD,167 St,86.0,70.0,197-198,Light,11:06:00 AM,84.9,,53.6,11:07:00 AM,Clear,,,,,D10,2024-07-10 11:06:00,95.06843159999984,87.23762067391607
7/10/2024 13:00:11,Cesar Pascal Vasquez,2024-07-10,BD,167 St,86.6,71.2,220-222,Light,12:58:00 PM,90.2,,68.5,1:00:00 PM,Clear,,,,,D10,2024-07-10 12:58:00,97.12516639142389,105.49266117180008
7/10/2024 10:58:52,Cesar Pascal Vasquez,2024-07-10,BD,170 St,87.4,72.4,195-196,Light,10:58:00 AM,89.3,,69.6,10:59:00 AM,Clear,,,,,D09,2024-07-10 10:58:00,99.88443657081632,103.60830796140414
7/10/2024 12:50:11,Cesar Pascal Vasquez,2024-07-10,BD,170 St,87.1,70.1,217-219,Medium,12:49:00 PM,88.4,,66.7,12:50:00 PM,Clear,,,,,D09,2024-07-10 12:49:00,97.88176995930098,99.4547616204844
7/10/2024 10:48:46,Cesar Pascal Vasquez,2024-07-10,BD,174-175 Sts,85.1,72.0,193-194,Light,10:47:00 AM,89.2,,65.3,10:49:00 AM,Clear,,,,,D08,2024-07-10 10:47:00,93.71324010190003,100.72911234331598
7/10/2024 12:44:04,Cesar Pascal Vasquez,2024-07-10,BD,174-175 Sts,86.2,70.7,215-216,Light,12:42:00 PM,88.9,,65.7,12:44:00 PM,Clear,,,,,D08,2024-07-10 12:42:00,95.87302597333603,100.18372941242923
7/10/2024 10:29:45,Cesar Pascal Vasquez,2024-07-10,BD,182-183 Sts,87.0,73.7,188-189,Light,10:28:00 AM,88.2,,68.4,10:30:00 AM,Clear,,,,,D06,2024-07-10 10:28:00,99.46105108540003,99.86760598822441
7/10/2024 12:27:00,Cesar Pascal Vasquez,2024-07-10,BD,182-183 Sts,85.7,72.3,211-212,Medium,12:25:00 PM,88.2,,61.9,12:26:00 PM,Clear,,,,,D06,2024-07-10 12:25:00,95.32427647146082,96.4891896643444
7/10/2024 10:00:39,Cesar Pascal Vasquez,2024-07-10,BD,Bedford Park Blvd,87.7,68.8,181-182,Medium,9:59:00 AM,85.7,,60.3,10:00:00 AM,Clear,,,,,D03,2024-07-10 09:59:00,98.77256205471623,90.6349458505808
7/10/2024 12:07:46,Cesar Pascal Vasquez,2024-07-10,BD,Bedford Park Blvd,86.5,79.2,205-206,Light,10:05:00 AM,88.0,,69.6,12:06:00 PM,Clear,,,,,D03,2024-07-10 10:05:00,100.92011611430009,99.9962743088001
7/10/2024 10:19:35,Cesar Pascal Vasquez,2024-07-10,BD,Fordham Rd,84.4,73.5,186-187,Medium,10:18:00 AM,90.1,,66.7,10:20:00 AM,Clear,,,,,D05,2024-07-10 10:18:00,92.59198076569999,104.01141380754942
7/10/2024 12:19:52,Cesar Pascal Vasquez,2024-07-10,BD,Fordham Rd,85.9,69.3,209-210,Medium,12:18:00 PM,89.2,,61.3,12:20:00 PM,Clear,,,,,D05,2024-07-10 12:18:00,94.52684832530898,98.49692779035621
7/10/2024 10:13:14,Cesar Pascal Vasquez,2024-07-10,BD,Kingsbridge Rd,84.1,68.7,183-185,Light,10:12:00 AM,86.9,,55.6,10:13:00 AM,Clear,,,,,D04,2024-07-10 10:12:00,90.26925336674913,91.1714761295159
7/10/2024 12:10:04,Cesar Pascal Vasquez,2024-07-10,BD,Kingsbridge Rd,86.0,68.8,207-208,Light,12:09:00 PM,90.4,,65.4,12:10:00 PM,Clear,,,,,D04,2024-07-10 12:09:00,94.55173358640015,103.99533233369624
7/10/2024 9:49:54,Cesar Pascal Vasquez,2024-07-10,BD,Norwood- 205 St,80.9,81.2,178-180,Light,9:47:00 AM,85.7,,78.0,9:49:00 AM,Clear,,,,,D01,2024-07-10 09:47:00,86.43039378276411,97.92035743870001
7/10/2024 11:56:51,Cesar Pascal Vasquez,2024-07-10,BD,Norwood- 205 St,87.0,76.6,201-204,Light,11:53:00 AM,86.5,,70.7,11:56:00 AM,Clear,,,,,D01,2024-07-10 11:53:00,101.02304159759993,96.63072425192493
7/10/2024 10:42:42,Cesar Pascal Vasquez,2024-07-10,BD,Tremont Av,85.0,72.5,190-192,Medium,10:41:00 AM,88.0,,68.3,10:43:00 AM,Clear,,,,,D07,2024-07-10 10:41:00,93.6678343750001,99.2878327477001
7/10/2024 12:32:34,Cesar Pascal Vasquez,2024-07-10,BD,Tremont Av,86.2,72.4,213-214,Light,12:31:00 PM,87.8,,51.2,12:33:00 PM,Clear,,,,,D07,2024-07-10 12:31:00,96.65319014102415,91.14223874665615
7/11/2024 12:29:37,Cesar Pascal Vasquez,2024-07-11,BD,161 St-Yankee Stadium,87.3,72.3,,Medium,11:27:00 AM,88.3,,70.7,11:28:00 AM,Clear,,,,,D11,2024-07-11 11:27:00,99.55395626746103,101.44184313462077
7/11/2024 12:28:28,Cesar Pascal Vasquez,2024-07-11,BD,167 St,86.9,75.3,,Light,11:14:00 AM,88.2,,60.3,11:16:00 AM,Clear,,,,,D10,2024-07-11 11:14:00,100.02394714798876,95.72135392085617
7/11/2024 12:27:01,Cesar Pascal Vasquez,2024-07-11,BD,170 St,87.8,70.1,,Light,11:01:00 AM,89.2,,62.7,11:04:00 AM,Clear,,,,,D09,2024-07-11 11:01:00,99.7319532021041,99.2584611800363
7/11/2024 12:25:36,Cesar Pascal Vasquez,2024-07-11,BD,174-175 Sts,87.9,72.3,,Light,10:49:00 AM,88.0,,65.6,10:51:00 AM,Clear,,,,,D08,2024-07-11 10:49:00,101.23459524062908,97.86851476480021
7/11/2024 12:22:33,Cesar Pascal Vasquez,2024-07-11,BD,182-183 Sts,87.9,75.4,,Medium,10:29:00 AM,87.5,,61.3,10:31:00 AM,Clear,,,,,D06,2024-07-11 10:29:00,103.05005202129624,94.66185569932505
7/11/2024 12:18:19,Cesar Pascal Vasquez,2024-07-11,BD,Bedford Park Blvd,87.4,72.3,,Light,9:52:00 AM,88.3,,63.9,9:54:00 AM,Clear,,,,,D03,2024-07-11 09:52:00,99.83048287474436,97.72306500206892
7/11/2024 12:21:07,Cesar Pascal Vasquez,2024-07-11,BD,Fordham Rd,87.8,72.3,,Light,10:16:00 AM,86.7,,62.1,10:18:00 AM,Clear,,,,,D05,2024-07-11 10:16:00,100.95090885685593,93.30484240034889
7/11/2024 12:19:29,Cesar Pascal Vasquez,2024-07-11,BD,Kingsbridge Rd,86.8,74.3,,Light,10:03:00 AM,87.6,,66.4,10:04:00 AM,Clear,,,,,D04,2024-07-11 10:03:00,99.21285217459578,97.29340256937596
7/11/2024 12:16:20,Cesar Pascal Vasquez,2024-07-11,BD,Norwood- 205 St,89.8,81.3,,Light,9:40:00 AM,86.6,,64.2,9:42:00 AM,Clear,,,,,D01,2024-07-11 09:40:00,113.6222728286962,93.96528826134394
7/11/2024 12:24:12,Cesar Pascal Vasquez,2024-07-11,BD,Tremont Av,86.8,70.1,,Medium,10:40:00 AM,86.5,,59.8,10:42:00 AM,Clear,,,,,D07,2024-07-11 10:40:00,97.10968967304403,91.9891779468
7/15/2024 11:55:29,Cesar Pascal Vasquez,2024-07-15,BD,161 St-Yankee Stadium,85.7,69.7,248-249,Heavy,11:52:00 AM,86.1,,74.1,11:55:00 AM,Overcast,,,,,D11,2024-07-15 11:52:00,94.21895183702075,97.18551695446094
7/15/2024 13:56:20,Cesar Pascal Vasquez,2024-07-15,BD,161 St-Yankee Stadium,87.3,64.8,272-274,Medium,1:53:00 PM,88.9,,63.9,1:56:00 PM,Clear,,,,,D11,2024-07-15 13:53:00,95.80933739903588,99.18165981238111
7/15/2024 11:46:59,Cesar Pascal Vasquez,2024-07-15,BD,167 St,85.5,70.3,246-247,Medium,11:47:00 AM,87.6,,66.7,11:45:00 AM,Overcast,,,,,D10,2024-07-15 11:47:00,93.99016117132497,97.44298638272417
7/15/2024 13:39:24,Cesar Pascal Vasquez,2024-07-15,BD,167 St,87.8,65.4,270-271,Medium,1:38:00 PM,86.2,,63.6,1:37:00 PM,Clear,,,,,D10,2024-07-15 13:38:00,97.280884896544,92.85894873622408
7/15/2024 11:38:37,Cesar Pascal Vasquez,2024-07-15,BD,170 St,85.4,71.5,244-245,Light,11:37:00 AM,86.3,,65.7,11:38:00 AM,Overcast,,,,,D09,2024-07-15 11:37:00,94.24085788139995,93.93220057854103
7/15/2024 13:30:52,Cesar Pascal Vasquez,2024-07-15,BD,170 St,87.8,64.9,268-269,Medium,1:30:00 PM,88.4,,62.5,1:29:00 PM,Clear,,,,,D09,2024-07-15 13:30:00,97.03240451858413,97.24662323970009
7/15/2024 11:29:34,Cesar Pascal Vasquez,2024-07-15,BD,174-175 Sts,85.7,71.7,241-143,Light,11:29:00 AM,87.6,,67.3,11:28:00 AM,Overcast,,,,,D08,2024-07-15 11:29:00,95.064816793141,97.74464831240398
7/15/2024 13:23:08,Cesar Pascal Vasquez,2024-07-15,BD,174-175 Sts,88.5,64.3,266-267,Medium,1:22:00 PM,87.9,,58.6,1:21:00 PM,Clear,,,,,D08,2024-07-15 13:22:00,98.41474185652538,94.30934573985613
7/15/2024 11:17:58,Cesar Pascal Vasquez,2024-07-15,BD,182-183 Sts,86.5,71.7,237-238,Medium,11:17:00 AM,88.3,,65.8,11:18:00 AM,Overcast,,,,,D06,2024-07-15 11:17:00,97.10489296992523,98.71585512081602
7/15/2024 13:06:43,Cesar Pascal Vasquez,2024-07-15,BD,182-183 Sts,88.0,70.5,261-262,Medium,1:05:00 PM,87.9,,65.4,1:06:00 PM,Clear,,,,,D06,2024-07-15 13:05:00,100.49627830250022,97.5228803204962
7/15/2024 10:48:55,Cesar Pascal Vasquez,2024-07-15,BD,Bedford Park Blvd,87.1,63.1,230-232,Heavy,10:46:00 AM,87.0,,67.0,10:48:00 AM,Overcast,,,,,D03,2024-07-15 10:46:00,94.58842561886084,96.12991049999984
7/15/2024 12:46:44,Cesar Pascal Vasquez,2024-07-15,BD,Bedford Park Blvd,87.0,63.2,253-255,Light,12:46:00 PM,88.6,,58.8,12:47:00 PM,Clear,,,,,D03,2024-07-15 12:46:00,94.41280969839988,95.87654560822386
7/15/2024 11:06:39,Cesar Pascal Vasquez,2024-07-15,BD,Fordham Rd,86.1,67.0,235-236,Medium,11:06:00 AM,88.3,,61.5,11:07:00 AM,Overcast,,,,,D05,2024-07-15 11:06:00,94.02452256840002,96.52031530272484
7/15/2024 13:02:31,Cesar Pascal Vasquez,2024-07-15,BD,Fordham Rd,86.5,67.4,258-260,Light,1:02:00 PM,90.1,,60.3,1:00:00 PM,Clear,,,,,D05,2024-07-15 13:02:00,95.12360843319998,100.08878601170913
7/15/2024 10:59:58,Cesar Pascal Vasquez,2024-07-15,BD,Kingsbridge Rd,89.3,70.2,233-234,Light,10:59:00 AM,88.3,,67.6,11:00:00 AM,Overcast,,,,,D04,2024-07-15 10:59:00,103.98991566625635,99.689500153884
7/15/2024 12:54:08,Cesar Pascal Vasquez,2024-07-15,BD,Kingsbridge Rd,87.0,67.8,256-257,Light,12:51:00 PM,88.1,,63.9,12:53:00 PM,Clear,,,,,D04,2024-07-15 12:51:00,96.50728777039996,97.24703522286089
7/15/2024 10:37:40,Cesar Pascal Vasquez,2024-07-15,BD,Norwood- 205 St,80.1,80.7,227-229,Light,10:34:00 AM,85.3,,74.9,10:37:00 AM,Overcast,,,,,D01,2024-07-15 10:34:00,84.54194505890896,95.41562534050901
7/15/2024 12:34:08,Cesar Pascal Vasquez,2024-07-15,BD,Norwood- 205 St,88.8,63.5,250-252,Light,12:31:00 PM,88.5,,66.6,12:33:00 PM,Clear,,,,,D01,2024-07-15 12:31:00,98.7196270693001,99.65697041960034
7/15/2024 11:24:55,Cesar Pascal Vasquez,2024-07-15,BD,Tremont Av,84.8,69.0,239-240,Medium,11:24:00 AM,89.2,,66.3,11:25:00 AM,Overcast,,,,,D07,2024-07-15 11:24:00,91.88190354159981,101.31426178355625
7/15/2024 13:13:20,Cesar Pascal Vasquez,2024-07-15,BD,Tremont Av,87.0,70.1,263-265,Light,1:10:00 PM,87.7,,70.5,1:13:00 PM,Clear,,,,,D07,2024-07-15 13:10:00,97.62301950459988,99.67923260832521
7/16/2024 10:05:51,Cesar Pascal Vasquez,2024-07-16,BD,161 St-Yankee Stadium,94.3,70.5,329-333,Medium,11:25:00 AM,92.3,,70.4,11:28:00 AM,Clear,,,,,D11,2024-07-16 11:25:00,120.56057769732494,113.50534881396403
7/16/2024 10:04:10,Cesar Pascal Vasquez,2024-07-16,BD,167 St,92.6,67.8,325-337,Light,11:17:00 AM,90.5,,66.4,11:19:00 AM,Clear,,,,,D10,2024-07-16 11:17:00,112.31100174198423,104.93708104230026
7/16/2024 9:53:29,Cesar Pascal Vasquez,2024-07-16,BD,170 St,92.1,70.2,323-324,Light,11:06:00 AM,90.2,,67.9,11:09:00 AM,Clear,,,,,D09,2024-07-16 11:06:00,112.67467543822441,105.08797426034413
7/16/2024 9:50:55,Cesar Pascal Vasquez,2024-07-16,BD,174-175 Sts,89.8,65.4,320-321,Light,10:47:00 AM,90.5,,63.9,10:49:00 AM,Clear,,,,,D08,2024-07-16 10:47:00,102.36783220246427,103.29495277292507
7/16/2024 9:46:03,Cesar Pascal Vasquez,2024-07-16,BD,182-183 Sts,91.2,70.3,314-316,Medium,10:25:00 AM,92.3,,68.9,10:27:00 AM,Clear,,,,,D06,2024-07-16 10:25:00,109.84070506443607,112.2546487279089
7/16/2024 9:35:39,Cesar Pascal Vasquez,2024-07-16,BD,Bedford Park Blvd,90.2,70.1,305-306,Light,9:53:00 AM,90.1,,65.3,9:56:00 AM,Clear,,,,,D03,2024-07-16 09:53:00,106.5926522589042,103.11226947250904
7/16/2024 9:42:38,Cesar Pascal Vasquez,2024-07-16,BD,Fordham Rd,92.3,72.2,313,Light,10:13:00 AM,91.3,,70.3,10:15:00 AM,Clear,,,,,D05,2024-07-16 10:13:00,115.04744060689609,110.15921532494123
7/16/2024 9:39:44,Cesar Pascal Vasquez,2024-07-16,BD,Kingsbridge Rd,91.2,70.3,307-309,Light,10:06:00 AM,89.9,,65.8,10:08:00 AM,Clear,,,,,D04,2024-07-16 10:06:00,109.84070506443607,102.88594767710413
7/16/2024 9:33:07,Cesar Pascal Vasquez,2024-07-16,BD,Norwood- 205 St,89.3,67.4,301-302,Light,9:42:00 AM,88.9,,66.3,9:45:00 AM,Clear,,,,,D01,2024-07-16 09:42:00,102.24277750302429,100.52534305418914
7/16/2024 9:47:59,Cesar Pascal Vasquez,2024-07-16,BD,Tremont Av,89.8,69.5,317-319,Medium,10:35:00 AM,90.7,,70.5,10:37:00 AM,Clear,,,,,D07,2024-07-16 10:35:00,104.99325352060025,108.4158596443251
7/17/2024 11:04:10,Cesar Pascal Vasquez,2024-07-17,BD,161 St-Yankee Stadium,93.2,71.3,,Medium,10:33:00 AM,90.7,,70.9,11:36:00 AM,Clear,,,,,D11,2024-07-17 10:33:00,117.39007078939618,108.71092580274923
7/17/2024 16:06:08,Cesar Pascal Vasquez,2024-07-17,BD,161 St-Yankee Stadium,97.2,78.6,N/a,Medium,3:33:00 PM,93.4,,72.4,3:36:00 PM,Clear,,,,,D11,2024-07-17 15:33:00,142.10274539926414,119.13775636329645
7/17/2024 11:02:32,Cesar Pascal Vasquez,2024-07-17,BD,167 St,88.6,70.0,,Medium,11:18:00 AM,90.6,,61.2,11:20:00 AM,Clear,,,,,D10,2024-07-17 11:18:00,101.87056483919984,101.85845326534422
7/17/2024 12:21:14,Cesar Pascal Vasquez,2024-07-17,BD,167 St,91.2,70.4,,Medium,1:37:00 PM,89.8,,68.9,1:40:00 PM,Clear,,,,,D10,2024-07-17 13:37:00,109.91743087398427,104.59703640738418
7/17/2024 11:00:46,Cesar Pascal Vasquez,2024-07-17,BD,170 St,90.3,69.8,,Medium,11:05:00 AM,91.3,,51.9,11:07:00 AM,Clear,,,,,D09,2024-07-17 11:05:00,106.68535574785602,98.11389791090915
7/17/2024 12:19:10,Cesar Pascal Vasquez,2024-07-17,BD,170 St,92.3,70.3,,Light,1:22:00 PM,89.9,,68.3,1:25:00 PM,Clear,,,,,D09,2024-07-17 13:22:00,113.42099654618104,104.49099152362929
7/17/2024 10:58:47,Cesar Pascal Vasquez,2024-07-17,BD,174-175 Sts,90.3,65.7,,Light,10:51:00 AM,89.7,,64.8,10:53:00 AM,Clear,,,,,D08,2024-07-17 10:51:00,103.91562045430103,101.7366713740762
7/17/2024 12:17:24,Cesar Pascal Vasquez,2024-07-17,BD,174-175 Sts,92.3,65.4,,Light,1:11:00 PM,90.8,,67.9,1:14:00 PM,Clear,,,,,D08,2024-07-17 13:11:00,109.45788128286407,106.84165045952419
7/17/2024 10:27:58,Cesar Pascal Vasquez,2024-07-17,BD,182-183 Sts,88.3,67.8,,Light,10:30:00 AM,88.0,,62.3,10:32:00 AM,Clear,,,,,D06,2024-07-17 10:30:00,99.79967134529605,96.2292372997003
7/17/2024 12:13:07,Cesar Pascal Vasquez,2024-07-17,BD,182-183 Sts,92.1,71.1,,Light,12:47:00 PM,90.4,,63.4,12:48:00 PM,Clear,,,,,D06,2024-07-17 12:47:00,113.42491017262118,102.71202305193616
7/17/2024 10:21:50,Cesar Pascal Vasquez,2024-07-17,BD,Bedford Park Blvd,87.4,67.8,N/a,Light,9:52:00 AM,86.5,,63.7,9:54:00 AM,Clear,,,,,D03,2024-07-17 09:52:00,97.49609257942421,93.53901984592503
7/17/2024 12:05:25,Cesar Pascal Vasquez,2024-07-17,BD,Bedford Park Blvd,91.2,74.6,,Light,12:06:00 PM,90.0,,60.1,12:08:00 PM,Clear,,,,,D03,2024-07-17 12:06:00,113.2556489247042,99.73440147330007
7/17/2024 10:26:10,Cesar Pascal Vasquez,2024-07-17,BD,Fordham Rd,89.4,70.2,,Medium,10:16:00 AM,90.1,,50.9,10:18:00 AM,Clear,,,,,D05,2024-07-17 10:16:00,104.2812901701441,95.19880398486117
7/17/2024 12:11:06,Cesar Pascal Vasquez,2024-07-17,BD,Fordham Rd,93.5,76.7,,Medium,12:33:00 PM,90.3,,50.1,12:36:00 PM,Clear,,,,,D05,2024-07-17 12:33:00,123.77031665852529,95.2105364310291
7/17/2024 16:19:24,Cesar Pascal Vasquez,2024-07-17,BD,Fordham Rd,97.8,74.5,,Medium,2:43:00 PM,91.0,,65.4,2:45:00 PM,Clear,,,,,D05,2024-07-17 14:43:00,139.30637584860006,105.66963982160024
7/17/2024 10:24:17,Cesar Pascal Vasquez,2024-07-17,BD,Kingsbridge Rd,88.2,65.4,,Medium,10:05:00 AM,87.9,,61.1,10:08:00 AM,Clear,,,,,D04,2024-07-17 10:05:00,98.25666781846435,95.43951314178128
7/17/2024 12:07:43,Cesar Pascal Vasquez,2024-07-17,BD,Kingsbridge Rd,92.3,70.0,,Medium,12:19:00 PM,89.8,,60.0,12:21:00 PM,Clear,,,,,D04,2024-07-17 12:19:00,113.16877311030021,99.20332575680015
7/17/2024 10:19:26,Cesar Pascal Vasquez,2024-07-17,BD,Norwood- 205 St,84.4,66.3,N/a,Light,9:40:00 AM,82.3,,51.6,9:43:00 AM,Clear,,,,,D01,2024-07-17 09:40:00,90.11457462592408,83.35381876924401
7/17/2024 12:01:30,Cesar Pascal Vasquez,2024-07-17,BD,Norwood- 205 St,90.6,70.3,,Light,11:53:00 AM,89.9,,66.7,11:55:00 AM,Clear,,,,,D01,2024-07-17 11:53:00,107.95892079122432,103.45545732858935
7/17/2024 14:26:01,Cesar Pascal Vasquez,2024-07-17,BD,Norwood- 205 St,93.7,70.8,,Light,2:25:00 PM,92.0,,69.4,2:28:00 PM,Clear,,,,,D01,2024-07-17 14:25:00,118.69518632375616,111.69369656159996
7/17/2024 10:29:44,Cesar Pascal Vasquez,2024-07-17,BD,Tremont Av,90.2,72.5,,Light,10:39:00 AM,86.9,,61.2,10:41:00 AM,Clear,,,,,D07,2024-07-17 10:39:00,108.29943704380028,93.35113565508394
7/17/2024 12:14:42,Cesar Pascal Vasquez,2024-07-17,BD,Tremont Av,95.4,77.9,,Light,12:59:00 PM,91.7,,57.9,1:01:00 PM,Clear,,,,,D07,2024-07-17 12:59:00,133.03714767109602,102.53804556922914
7/17/2024 15:08:32,Cesar Pascal Vasquez,2024-07-17,BD,Tremont Av,93.4,75.7,N/a,Light,3:07:00 PM,91.5,,68.7,3:08:00 PM,Clear,,,,,D07,2024-07-17 15:07:00,122.36320308194418,109.55772041592535
7/24/2024 13:40:56,Cesar Pascal Vasquez,2024-07-23,BD,170 St,86.3,71.3,,Light,1:49:00 PM,79.7,,67.8,1:51:00 PM,Overcast,,,,,D09,2024-07-23 13:49:00,96.40053567798091,79.7
7/24/2024 12:18:36,Cesar Pascal Vasquez,2024-07-23,BD,Norwood- 205 St,85.3,70.1,,Light,12:20:00 PM,80.4,,68.9,12:23:00 AM,Overcast,,,,,D01,2024-07-23 12:20:00,93.43698674482903,83.45288723227594
7/24/2024 7:04:22,Cesar Pascal Vasquez,2024-07-24,BD,161 St-Yankee Stadium,84.7,74.7,,Medium,11:38:00 AM,85.3,,70.1,11:41:00 AM,Overcast,,On this station thereâ€™s ramps that arenâ€™t going up too.,,,D11,2024-07-24 11:38:00,93.78669372346081,93.43698674482903
7/24/2024 14:14:44,Cesar Pascal Vasquez,2024-07-24,BD,161 St-Yankee Stadium,87.5,79.7,,Medium,2:16:00 PM,88.3,,78.9,2:19:00 PM,Overcast,,,,,D11,2024-07-24 14:16:00,104.39457456932507,106.53768812186884
7/24/2024 7:01:11,Cesar Pascal Vasquez,2024-07-24,BD,167 St,85.6,75.6,,Medium,11:27:00 AM,83.5,,68.9,11:29:00 AM,Overcast,,,,,D10,2024-07-24 11:27:00,96.52587184265595,89.09058598472491
7/24/2024 13:43:11,Cesar Pascal Vasquez,2024-07-24,BD,167 St,86.4,71.2,,Light,2:02:00 PM,83.2,,65.9,2:05:00 PM,Overcast,,,,,D10,2024-07-24 14:02:00,96.60983099462422,87.68435166072413
7/24/2024 6:58:47,Cesar Pascal Vasquez,2024-07-24,BD,170 St,84.7,70.3,,Medium,11:16:00 AM,82.3,,67.9,11:19:00 AM,Overcast,,,,,D09,2024-07-24 11:16:00,92.12800416302088,86.52508344618909
7/24/2024 6:56:38,Cesar Pascal Vasquez,2024-07-24,BD,174-175 Sts,85.3,75.2,,Medium,10:49:00 AM,81.2,,65.4,10:52:00 AM,Overcast,,,,,D08,2024-07-24 10:49:00,95.54456715679616,84.18393873798392
7/24/2024 13:38:58,Cesar Pascal Vasquez,2024-07-24,BD,174-175 Sts,85.1,75.2,,Light,1:37:00 PM,83.4,,83.2,1:38:00 PM,Overcast,,,,,D08,2024-07-24 13:37:00,95.01805823796391,93.47068233254377
7/24/2024 6:50:56,Cesar Pascal Vasquez,2024-07-24,BD,182-183 Sts,86.3,74.0,,Medium,10:23:00 AM,83.2,,64.3,10:25:00 AM,Clear,,,,,D06,2024-07-24 10:23:00,97.67937597909993,87.27335596971608
7/24/2024 13:29:36,Cesar Pascal Vasquez,2024-07-24,BD,182-183 Sts,84.6,73.4,,Light,1:13:00 PM,81.3,,70.2,1:15:00 PM,Overcast,,,,,D06,2024-07-24 13:13:00,93.03967908457595,85.19087246753604
7/24/2024 6:42:41,Cesar Pascal Vasquez,2024-07-24,BD,Bedford Park Blvd,86.3,73.2,,Light,9:51:00 AM,82.9,,50.3,9:54:00 AM,Overcast,,,,,D03,2024-07-24 09:51:00,97.29444068911596,83.83443147910899
7/24/2024 12:22:33,Cesar Pascal Vasquez,2024-07-24,BD,Bedford Park Blvd,84.3,75.0,,Medium,12:34:00 PM,81.1,,70.3,12:36:00 PM,Overcast,,,,,D03,2024-07-24 12:34:00,92.89764815479992,84.85246969878904
7/24/2024 6:48:17,Cesar Pascal Vasquez,2024-07-24,BD,Fordham Rd,86.7,72.3,,Medium,10:14:00 AM,85.2,,65.6,10:17:00 AM,Overcast,,,,,D05,2024-07-24 10:14:00,97.92486768502098,91.51712146614399
7/24/2024 12:57:37,Cesar Pascal Vasquez,2024-07-24,BD,Fordham Rd,84.3,75.3,,Medium,12:59:00 PM,82.5,,70.3,1:01:00 PM,Overcast,,,,,D05,2024-07-24 12:59:00,93.00846964186104,87.4671440873249
7/24/2024 6:45:46,Cesar Pascal Vasquez,2024-07-24,BD,Kingsbridge Rd,83.7,67.8,,Light,10:01:00 AM,84.3,,55.4,10:03:00 AM,Overcast,,,,,D04,2024-07-24 10:01:00,89.17166229713617,86.80154829678416
7/24/2024 12:26:26,Cesar Pascal Vasquez,2024-07-24,BD,Kingsbridge Rd,85.0,73.2,,Medium,12:46:00 PM,84.6,,70.3,12:48:00 AM,Overcast,,,,,D04,2024-07-24 12:46:00,93.94560653120003,91.90150824194396
7/24/2024 6:38:06,Cesar Pascal Vasquez,2024-07-24,BD,Norwood- 205 St,85.1,70.7,,Light,9:43:00 AM,83.4,,53.4,9:45:00 AM,Overcast,,"On the steeps I just counted the actual stairs, thereâ€™s a ramp thatâ€™s fairly long that go up. I would say 15 meters long.",,,D01,2024-07-24 09:43:00,93.20273307490879,85.06045385417598
7/24/2024 6:53:40,Cesar Pascal Vasquez,2024-07-24,BD,Tremont Av,87.3,72.3,,Light,10:35:00 AM,76.9,,63.9,10:37:00 AM,Overcast,,,,,D07,2024-07-24 10:35:00,99.55395626746103,76.9
7/24/2024 13:33:50,Cesar Pascal Vasquez,2024-07-24,BD,Tremont Av,84.6,72.4,,Light,1:29:00 PM,78.9,,70.5,1:30:00 PM,Overcast,,,,,D07,2024-07-24 13:29:00,92.66604102729599,78.9
7/25/2024 11:52:57,Cesar Pascal Vasquez,2024-07-25,BD,161 St-Yankee Stadium,87.1,60.1,466-467,Medium,11:45:00 AM,86.7,,65.8,11:52:00 AM,Overcast,,,,,D11,2024-07-25 11:45:00,93.30798721310082,94.88059662993592
7/25/2024 11:32:09,Cesar Pascal Vasquez,2024-07-25,BD,167 St,86.9,78.5,445-446,Medium,11:31:00 AM,85.0,,67.8,11:33:00 AM,Overcast,,,,,D10,2024-07-25 11:31:00,101.77446467432489,91.88641427119998
7/25/2024 11:26:46,Cesar Pascal Vasquez,2024-07-25,BD,170 St,87.7,61.4,423-424,Medium,11:22:00 AM,84.5,,58.9,11:24:00 AM,Overcast,,,,,D09,2024-07-25 11:22:00,95.14032104286419,88.05812380372498
7/25/2024 11:08:19,Cesar Pascal Vasquez,2024-07-25,BD,174-175 Sts,87.2,63.7,400-401,Light,11:07:00 AM,81.3,,50.9,11:08:00 AM,Overcast,,,,,D08,2024-07-25 11:07:00,95.0775341798761,82.15180434058905
7/25/2024 10:14:05,Cesar Pascal Vasquez,2024-07-25,BD,Bedford Park Blvd,86.0,65.0,298-299,Light,10:13:00 AM,86.3,,57.8,10:15:00 AM,Overcast,,,,,D03,2024-07-25 10:13:00,92.98786210000009,90.87245022961612
7/25/2024 10:36:35,Cesar Pascal Vasquez,2024-07-25,BD,Fordham Rd,85.2,66.3,,Medium,10:36:00 AM,83.2,,55.3,10:38:00 AM,Overcast,,,,,D05,2024-07-25 10:36:00,91.77037248371622,85.18685874435602
7/25/2024 10:28:41,Cesar Pascal Vasquez,2024-07-25,BD,Kingsbridge Rd,85.3,68.1,320-321,Light,10:28:00 AM,83.2,,57.7,10:30:00 AM,Overcast,,,,,D04,2024-07-25 10:28:00,92.65945981046909,85.70584081347621
7/25/2024 10:03:09,Cesar Pascal Vasquez,2024-07-25,BD,Norwood- 205 St,82.0,85.5,276-277,Light,9:55:00 AM,80.6,,61.5,10:01:00 AM,Overcast,,,,,D01,2024-07-25 09:55:00,90.28333692250023,82.74252756939998
7/25/2024 10:56:58,Cesar Pascal Vasquez,2024-07-25,BD,Tremont Av,87.2,70.9,377-378,Medium,10:56:00 AM,83.9,,63.5,10:58:00 AM,Overcast,,,,,D07,2024-07-25 10:56:00,98.55040029968399,88.31164870232496
7/30/2024 11:53:18,Cesar Pascal Vasquez,2024-07-30,BD,161 St-Yankee Stadium,87.6,70.5,468-471,Medium,11:13:00 AM,86.9,,71.0,11:17:00 AM,Clear,,,,,D11,2024-07-30 11:13:00,99.40967994529998,97.80924140919981
7/30/2024 12:37:16,Cesar Pascal Vasquez,2024-07-30,BD,161 St-Yankee Stadium,89.7,71.2,472-475,Medium,2:03:00 PM,88.9,,70.3,2:07:00 PM,Clear,,,,,D11,2024-07-30 14:03:00,105.8346966284761,102.89975631042908
7/30/2024 11:49:47,Cesar Pascal Vasquez,2024-07-30,BD,167 St,86.3,70.2,447-450,Light,10:38:00 AM,86.4,,66.9,10:40:00 AM,Clear,,,,,D10,2024-07-30 10:38:00,95.89608069073586,94.67093276099614
7/30/2024 12:30:22,Cesar Pascal Vasquez,2024-07-30,BD,167 St,87.9,70.2,452-454,Light,1:49:00 PM,87.4,,67.6,1:51:00 PM,Clear,,,,,D10,2024-07-30 13:49:00,100.05685974046422,97.39658897529623
7/30/2024 11:47:17,Cesar Pascal Vasquez,2024-07-30,BD,170 St,87.8,71.2,425-428,Light,10:23:00 AM,84.3,,65.3,10:25:00 AM,Clear,,,,,D09,2024-07-30 10:23:00,100.33572002985602,89.59898324046108
7/30/2024 12:27:48,Cesar Pascal Vasquez,2024-07-30,BD,170 St,88.7,70.1,428-430,Light,1:34:00 PM,87.3,,69.9,1:37:00 PM,Clear,,,,,D09,2024-07-30 13:34:00,102.21086609686927,98.30099420702892
7/30/2024 11:45:02,Cesar Pascal Vasquez,2024-07-30,BD,174-175 Sts,85.3,69.8,402-405,Light,10:09:00 AM,84.3,,65.3,10:11:00 AM,Clear,,,,,D08,2024-07-30 10:09:00,93.31859873665624,89.59898324046108
7/30/2024 12:19:51,Cesar Pascal Vasquez,2024-07-30,BD,174-175 Sts,88.7,69.8,405-407,Light,1:20:00 PM,87.6,,64.5,1:23:00 PM,Clear,,,,,D08,2024-07-30 13:20:00,102.03136673281618,96.36534617089985
7/30/2024 11:38:40,Cesar Pascal Vasquez,2024-07-30,BD,182-183 Sts,85.6,72.3,358-363,Light,10:39:00 AM,80.7,,67.3,10:40:00 AM,Clear,,,,,D06,2024-07-30 10:39:00,95.07209310424405,83.7008269904611
7/30/2024 12:13:50,Cesar Pascal Vasquez,2024-07-30,BD,182-183 Sts,87.8,69.3,363-366,Light,12:52:00 PM,86.7,,68.7,12:55:00 PM,Clear,,,,,D06,2024-07-30 12:52:00,99.30002420293602,96.1953407072209
7/30/2024 11:31:15,Cesar Pascal Vasquez,2024-07-30,BD,Bedford Park Blvd,83.5,72.3,300-302,Light,10:02:00 AM,81.2,,66.3,10:04:00 AM,Clear,,,,,D03,2024-07-30 10:02:00,90.10702406652513,84.33464986867607
7/30/2024 12:06:01,Cesar Pascal Vasquez,2024-07-30,BD,Bedford Park Blvd,87.8,71.3,303-306,Light,12:18:00 PM,86.7,,68.9,12:20:00 PM,Clear,,,,,D03,2024-07-30 12:18:00,100.39117430341616,96.28859421454894
7/30/2024 11:36:11,Cesar Pascal Vasquez,2024-07-30,BD,Fordham Rd,84.6,70.3,340-342,Medium,10:27:00 AM,79.9,,65.7,10:30:00 AM,Clear,,,,,D05,2024-07-30 10:27:00,91.90150824194396,79.9
7/30/2024 12:10:36,Cesar Pascal Vasquez,2024-07-30,BD,Fordham Rd,88.2,71.3,344-346,Medium,12:39:00 PM,86.7,,65.8,12:40:00 PM,Clear,,,,,D05,2024-07-30 12:39:00,101.50904224309646,94.88059662993592
7/30/2024 11:32:49,Cesar Pascal Vasquez,2024-07-30,BD,Kingsbridge Rd,85.3,74.3,322-324,Light,10:15:00 AM,83.2,,63.9,10:17:00 AM,Clear,,,,,D04,2024-07-30 10:15:00,95.159604144661,87.17249680408418
7/30/2024 12:07:59,Cesar Pascal Vasquez,2024-07-30,BD,Kingsbridge Rd,87.8,70.3,325-328,Light,12:31:00 PM,86.5,,67.8,12:33:00 PM,Clear,,,,,D04,2024-07-30 12:31:00,99.84087941877581,95.30157712279994
7/30/2024 11:29:28,Cesar Pascal Vasquez,2024-07-30,BD,Norwood- 205 St,84.3,70.4,278-280,Light,9:50:00 AM,82.4,,67.8,9:53:00 AM,Clear,,,,,D01,2024-07-30 09:50:00,91.26450961908398,86.6844621658239
7/30/2024 12:03:32,Cesar Pascal Vasquez,2024-07-30,BD,Norwood- 205 St,87.8,69.8,281-283,Light,12:04:00 PM,86.9,,67.8,12:07:00 PM,Clear,,,,,D01,2024-07-30 12:04:00,99.56927185225616,96.26345271966392
7/30/2024 11:40:47,Cesar Pascal Vasquez,2024-07-30,BD,Tremont Av,87.4,74.3,379-383,Medium,10:57:00 AM,80.6,,60.9,10:59:00 AM,Clear,,,,,D07,2024-07-30 10:57:00,100.92672582546436,82.66341867349615
7/30/2024 12:17:15,Cesar Pascal Vasquez,2024-07-30,BD,Tremont Av,87.8,70.3,383-386,Light,1:07:00 PM,85.7,,63.6,1:10:00 PM,Clear,,,,,D07,2024-07-30 13:07:00,99.84087941877581,91.81960632420393
7/31/2024 16:55:31,Cesar Pascal Vasquez,2024-07-31,BD,161 St-Yankee Stadium,84.7,57.2,475-478,Medium,10:27:00 AM,86.6,,55.8,10:29:00 AM,Clear,,,,,D11,2024-07-31 10:27:00,87.90953411503597,90.70548152598398
7/31/2024 17:23:42,Cesar Pascal Vasquez,2024-07-31,BD,161 St-Yankee Stadium,87.1,60.0,479-480,Medium,12:47:00 PM,86.9,,58.6,12:50:00 PM,Clear,,,,,D11,2024-07-31 12:47:00,93.26665954669997,92.30588243937586
7/31/2024 16:53:02,Cesar Pascal Vasquez,2024-07-31,BD,167 St,86.4,57.2,453-457,Light,10:17:00 AM,87.2,,53.4,10:18:00 AM,Clear,,,,,D10,2024-07-31 10:17:00,90.8418610632639,90.90558716358407
7/31/2024 17:22:14,Cesar Pascal Vasquez,2024-07-31,BD,167 St,85.9,51.1,458-460,Medium,12:36:00 PM,83.5,,56.6,12:37:00 PM,Clear,,,,,D10,2024-07-31 12:36:00,88.05253726682102,85.8998236276
7/31/2024 16:51:02,Cesar Pascal Vasquez,2024-07-31,BD,170 St,90.1,60.2,431-434,Medium,10:10:00 AM,86.2,,57.7,10:12:00 AM,Clear,,,,,D09,2024-07-31 10:10:00,100.03130854926424,90.65413925925604
7/31/2024 17:20:42,Cesar Pascal Vasquez,2024-07-31,BD,170 St,86.3,50.1,435-439,Light,12:25:00 PM,86.6,,52.4,12:27:00 PM,Clear,,,,,D09,2024-07-31 12:25:00,88.36587229798897,89.55104619673595
7/31/2024 16:48:02,Cesar Pascal Vasquez,2024-07-31,BD,174-175 Sts,86.8,51.3,406-408,Light,9:59:00 AM,88.1,,55.3,10:00:00 AM,Clear,,,,,D08,2024-07-31 09:59:00,89.51786984987584,93.29134518474885
7/31/2024 17:17:51,Cesar Pascal Vasquez,2024-07-31,BD,174-175 Sts,88.1,55.5,409-411,Light,12:13:00 PM,86.3,,51.7,12:15:00 PM,Clear,,,,,D08,2024-07-31 12:13:00,93.3751552539249,88.84806720170087
7/31/2024 16:43:53,Cesar Pascal Vasquez,2024-07-31,BD,182-183 Sts,87.0,60.2,362-365,Light,9:38:00 AM,85.3,,56.4,9:39:00 AM,Clear,,,,,D06,2024-07-31 09:38:00,93.14524734639983,88.66376054596401
7/31/2024 17:14:03,Cesar Pascal Vasquez,2024-07-31,BD,182-183 Sts,88.8,59.0,366-368,Medium,11:49:00 AM,88.2,,52.9,10:51:00 AM,Clear,,,,,D06,2024-07-31 11:49:00,96.40750048960028,92.49784330946436
7/31/2024 16:36:19,Cesar Pascal Vasquez,2024-07-31,BD,Bedford Park Blvd,83.9,60.5,305-307,Light,9:01:00 AM,83.6,,62.1,9:03:00 AM,Clear,,,,,D03,2024-07-31 09:01:00,87.49029406592507,87.40300281019607
7/31/2024 17:07:05,Cesar Pascal Vasquez,2024-07-31,BD,Bedford Park Blvd,86.7,58.1,308-310,Light,11:12:00 AM,86.9,,49.5,11:14:00 AM,Clear,,,,,D03,2024-07-31 11:12:00,91.72956667162887,89.10161033552494
7/31/2024 16:41:50,Cesar Pascal Vasquez,2024-07-31,BD,Fordham Rd,85.1,57.0,347-349,Medium,9:27:00 AM,87.2,,59.6,9:28:00 AM,Clear,,,,,D05,2024-07-31 09:27:00,88.51042099240003,93.3045737525441
7/31/2024 17:12:18,Cesar Pascal Vasquez,2024-07-31,BD,Fordham Rd,87.2,57.6,350-351,Medium,11:37:00 AM,86.5,,53.1,11:39:00 AM,Clear,,,,,D05,2024-07-31 11:37:00,92.49360353478392,89.61511814232495
7/31/2024 16:39:16,Cesar Pascal Vasquez,2024-07-31,BD,Kingsbridge Rd,86.8,63.0,326-328,Light,9:14:00 AM,82.9,,57.5,9:16:00 AM,Clear,,,,,D04,2024-07-31 09:14:00,93.89247033919995,85.22595423032502
7/31/2024 17:10:01,Cesar Pascal Vasquez,2024-07-31,BD,Kingsbridge Rd,87.5,60.7,329-331,Light,11:25:00 AM,85.7,,55.5,11:27:00 AM,Clear,,,,,D04,2024-07-31 11:25:00,94.396566956325,89.05386965432493
7/31/2024 16:32:34,Cesar Pascal Vasquez,2024-07-31,BD,Norwood- 205 St,84.5,59.5,283-286,Light,8:50:00 AM,82.6,,63.7,8:51:00 AM,Clear,,,,,D01,2024-07-31 08:50:00,88.22887982812512,86.10394153010381
7/31/2024 17:04:33,Cesar Pascal Vasquez,2024-07-31,BD,Norwood- 205 St,81.1,53.8,287-289,Light,11:03:00 AM,84.8,,55.6,11:05:00 AM,Clear,,,,,D01,2024-07-31 11:03:00,82.32051250382395,87.62487331286394
7/31/2024 16:45:57,Cesar Pascal Vasquez,2024-07-31,BD,Tremont Av,84.6,56.8,383-386,Medium,9:49:00 AM,84.5,,55.3,9:51:00 AM,Clear,,,,,D07,2024-07-31 09:49:00,87.63712506998385,87.079507437525
7/31/2024 17:16:04,Cesar Pascal Vasquez,2024-07-31,BD,Tremont Av,87.9,54.3,387-390,Light,11:59:00 AM,85.9,,51.7,11:02:00 AM,Clear,,,,,D07,2024-07-31 11:59:00,92.50493705594918,88.22631023970902
8/1/2024 10:21:46,Cesar Pascal Vasquez,2024-08-01,BD,161 St-Yankee Stadium,89.6,61.0,481-484,Medium,10:17:00 AM,86.6,,61.4,10:19:00 AM,Clear,,,,,D11,2024-08-01 10:17:00,99.28343436720006,92.81419546825616
8/1/2024 10:13:42,Cesar Pascal Vasquez,2024-08-01,BD,167 St,89.3,58.4,461-463,Medium,10:10:00 AM,87.6,,53.4,10:12:00 AM,Clear,,,,,D10,2024-08-01 10:10:00,97.20793496364419,91.61007618713586
8/1/2024 12:26:59,Cesar Pascal Vasquez,2024-08-01,BD,167 St,90.2,64.0,464,Medium,12:36:00 PM,89.8,,60.8,12:38:00 PM,Clear,,,,,D10,2024-08-01 12:36:00,102.56134346160025,99.65109698137627
8/1/2024 10:02:56,Cesar Pascal Vasquez,2024-08-01,BD,170 St,90.7,66.4,440-442,Medium,9:59:00 AM,88.3,,59.3,10:01:00 AM,Clear,,,,,D09,2024-08-01 09:59:00,105.50513682068421,95.46810151698105
8/1/2024 12:23:46,Cesar Pascal Vasquez,2024-08-01,BD,170 St,89.7,56.9,442-444,Light,12:25:00 PM,87.9,,52.4,12:27:00 PM,Clear,,,,,D09,2024-08-01 12:25:00,97.31860571242893,91.7638325873562
8/1/2024 10:00:55,Cesar Pascal Vasquez,2024-08-01,BD,174-175 Sts,87.3,63.6,412-416,Light,9:49:00 AM,89.3,,61.3,9:52:00 AM,Clear,,,,,D08,2024-08-01 09:49:00,95.25684063460392,98.73350136950108
8/1/2024 12:14:14,Cesar Pascal Vasquez,2024-08-01,BD,174-175 Sts,89.2,56.7,417-422,Light,12:13:00 PM,86.3,,51.8,12:15:00 PM,Clear,,,,,D08,2024-08-01 12:13:00,96.14435687987597,88.87887763297599
8/1/2024 9:54:56,Cesar Pascal Vasquez,2024-08-01,BD,182-183 Sts,91.5,70.3,369-373,Light,9:27:00 AM,90.0,,56.5,9:28:00 AM,Clear,,,,,D06,2024-08-01 09:27:00,110.80041831592499,97.76709497250027
8/1/2024 11:55:59,Cesar Pascal Vasquez,2024-08-01,BD,182-183 Sts,89.8,66.4,374-376,Medium,11:49:00 AM,88.2,,57.8,11:51:00 AM,Clear,,,,,D06,2024-08-01 11:49:00,102.99045112358432,94.5720494522562
8/1/2024 9:44:57,Cesar Pascal Vasquez,2024-08-01,BD,Bedford Park Blvd,86.4,64.7,312-315,Light,8:50:00 AM,85.4,,67.4,8:51:00 AM,Clear,,,,,D03,2024-08-01 08:50:00,93.7362985845642,92.61396098185591
8/1/2024 11:17:00,Cesar Pascal Vasquez,2024-08-01,BD,Bedford Park Blvd,88.6,60.2,316-319,Light,11:12:00 AM,89.7,,55.3,11:15:00 AM,Clear,,,,,D03,2024-08-01 11:12:00,96.55553430294415,96.50997739022094
8/1/2024 9:50:22,Cesar Pascal Vasquez,2024-08-01,BD,Fordham Rd,87.4,70.2,352-353,Light,9:14:00 AM,87.4,,70.1,9:16:00 AM,Clear,,,,,D05,2024-08-01 09:14:00,98.7183291823042,98.66636347909625
8/1/2024 11:42:35,Cesar Pascal Vasquez,2024-08-01,BD,Fordham Rd,90.3,61.4,354-355,Medium,11:37:00 AM,89.4,,59.4,11:40:00 AM,Clear,,,,,D05,2024-08-01 11:37:00,101.22626215086404,97.95097391753616
8/1/2024 9:48:07,Cesar Pascal Vasquez,2024-08-01,BD,Kingsbridge Rd,87.3,65.2,332-335,Light,9:01:00 AM,85.5,,57.5,9:03:00 AM,Clear,,,,,D04,2024-08-01 09:01:00,95.99636228247596,89.34341004812491
8/1/2024 11:28:01,Cesar Pascal Vasquez,2024-08-01,BD,Kingsbridge Rd,89.4,61.3,336-339,Light,11:25:00 AM,88.7,,57.8,11:27:00 AM,Clear,,,,,D04,2024-08-01 11:25:00,98.97129507122413,95.61467027953611
8/1/2024 11:07:50,Cesar Pascal Vasquez,2024-08-01,BD,Norwood- 205 St,88.1,63.1,294-297,Light,11:03:00 AM,87.9,,54.7,11:05:00 AM,Clear,,,,,D01,2024-08-01 11:03:00,96.84867108758088,92.66534758926917
8/1/2024 9:41:58,Cesar Pascal Vasquez,2024-08-01,BD,Norwood-205 St,87.5,65.5,290-293,Light,8:39:00 AM,85.7,,63.7,8:41:00 AM,Clear,,,,,D01,2024-08-01 08:39:00,96.610980733125,91.85674747586108
8/1/2024 9:57:35,Cesar Pascal Vasquez,2024-08-01,BD,Tremont Av,87.7,60.3,391-394,Light,9:38:00 AM,85.8,,56.7,9:40:00 AM,Clear,,,,,D07,2024-08-01 09:38:00,94.64405293390121,89.60590891685574
8/1/2024 12:58:50,Cesar Pascal Vasquez,2024-08-02,BD,191 St,91.3,65.3,472-477,Medium,12:47:00 PM,90.2,,66.0,12:53:00 PM,Clear,,,,,110,2024-08-02 12:47:00,106.45339396074105,103.83456896080015
9/13/2024 1:14:24,Cesar Pascal Vasquez,2024-09-12,BD,161 St-Yankee Stadium,80.0,66.3,,Light,10:36:00 AM,81.1,,61.4,10:43:00 AM,Clear,,,,,D11,2024-09-12 10:36:00,80.0,83.40166405249599
9/13/2024 1:16:31,Cesar Pascal Vasquez,2024-09-12,BD,163 St-Amsterdam Av,79.7,60.3,,Light,10:53:00 AM,80.3,,55.8,10:55:00 AM,Clear,,,,,A10,2024-09-12 10:53:00,79.7,81.69051027409601
9/13/2024 1:20:08,Cesar Pascal Vasquez,2024-09-12,BD,167 St,78.9,63.4,,Light,11:06:00 AM,77.3,,63.2,11:08:00 AM,Clear,,,,,D10,2024-09-12 11:06:00,78.9,77.3
9/13/2024 1:23:13,Cesar Pascal Vasquez,2024-09-12,BD,170 St,78.9,62.8,,Light,10:17:00 AM,77.5,,58.9,10:19:00 AM,Clear,,,,,D09,2024-09-12 10:17:00,78.9,77.5
9/13/2024 1:25:01,Cesar Pascal Vasquez,2024-09-12,BD,174-175 Sts,76.9,62.3,,Light,10:28:00 AM,74.7,,60.2,10:30:00 AM,Clear,,,,,D08,2024-09-12 10:28:00,76.9,74.7
9/13/2024 1:28:08,Cesar Pascal Vasquez,2024-09-12,BD,Tremont Av,75.4,60.3,,Light,10:47:00 AM,74.3,,55.4,10:50:00 AM,Clear,,,,,D07,2024-09-12 10:47:00,75.4,74.3
9/13/2024 1:31:51,Cesar Pascal Vasquez,2024-09-12,BD,182-183 Sts,78.7,60.2,,Light,11:10:00 AM,79.3,,56.8,11:11:00 AM,Clear,,,,,D06,2024-09-12 11:10:00,78.7,79.3
9/13/2024 1:33:49,Cesar Pascal Vasquez,2024-09-12,BD,Fordham Rd,83.5,67.9,,Medium,11:18:00 AM,81.2,,58.3,11:20:00 AM,Clear,,,,,D05,2024-09-12 11:18:00,88.80271510672495,83.0694526987561
9/13/2024 1:36:59,Cesar Pascal Vasquez,2024-09-12,BD,Kingsbridge Rd,80.2,62.3,,Light,11:29:00 AM,79.4,,57.8,11:31:00 AM,Clear,,,,,D04,2024-09-12 11:29:00,82.31927321365617,79.4
9/13/2024 1:38:59,Cesar Pascal Vasquez,2024-09-12,BD,Bedford Park Blvd,80.1,64.3,,Light,11:40:00 AM,79.3,,54.3,11:43:00 AM,Clear,,,,,D03,2024-09-12 11:40:00,82.42175944014899,79.3
9/13/2024 1:41:38,Cesar Pascal Vasquez,2024-09-12,BD,Norwood-205 St,79.8,65.3,,Light,11:57:00 AM,78.4,,57.3,12:01:00 PM,Clear,,,,,D01,2024-09-12 11:57:00,79.8,78.4
9/20/2024 10:09:14,Cesar Pascal Vasquez,2024-09-20,BD,161 St-Yankee Stadium,85.2,70.1,,Medium,8:03:00 AM,82.5,,66.3,8:06:00 AM,Clear,,,,,D11,2024-09-20 08:03:00,93.20326275720407,86.52002018532494
9/20/2024 10:11:12,Cesar Pascal Vasquez,2024-09-20,BD,167 St,81.3,66.4,,Light,8:15:00 AM,79.6,,50.3,8:17:00 AM,Clear,,,,,D10,2024-09-20 08:15:00,84.512178142524,79.6
9/20/2024 10:12:59,Cesar Pascal Vasquez,2024-09-20,BD,170 St,82.7,68.0,,Light,8:28:00 AM,80.9,,54.2,8:31:00 AM,Clear,,,,,D09,2024-09-20 08:28:00,87.28724740270016,82.15246970958405
9/20/2024 10:14:53,Cesar Pascal Vasquez,2024-09-20,BD,174-175 Sts,84.1,69.7,,Light,8:42:00 AM,81.9,,56.0,8:44:00 AM,Clear,,,,,D08,2024-09-20 08:42:00,90.59298506898908,83.59557688270016
9/20/2024 10:18:46,Cesar Pascal Vasquez,2024-09-20,BD,Tremont Av,83.9,69.1,,Light,8:55:00 AM,81.4,,53.9,8:57:00 AM,Clear,,,,,D07,2024-09-20 08:55:00,89.97614745242115,82.67097276085605
9/20/2024 10:20:17,Cesar Pascal Vasquez,2024-09-20,BD,182-183 Sts,84.5,69.8,,Light,9:08:00 AM,82.0,,55.0,9:10:00 AM,Clear,,,,,D06,2024-09-20 09:08:00,91.50115809640008,83.5548902400001
9/20/2024 10:22:13,Cesar Pascal Vasquez,2024-09-20,BD,Fordham Rd,83.0,68.5,,Medium,9:21:00 AM,80.8,,53.0,9:24:00 AM,Clear,,,,,D05,2024-09-20 09:21:00,87.98693527500001,81.89597563120014
9/20/2024 10:24:09,Cesar Pascal Vasquez,2024-09-20,BD,Kingsbridge Rd,83.7,69.0,,Light,9:36:00 AM,81.3,,54.7,9:39:00 AM,Clear,,,,,D04,2024-09-20 09:36:00,89.5295485916003,82.669841505981
9/20/2024 10:26:00,Cesar Pascal Vasquez,2024-09-20,BD,Bedford Park Blvd,84.0,69.5,,Light,9:51:00 AM,81.6,,55.2,9:54:00 AM,Clear,,,,,D03,2024-09-20 09:51:00,90.31399527250022,83.09744962438396
9/20/2024 10:28:39,Cesar Pascal Vasquez,2024-09-20,BD,Norwood-205 St,83.6,66.4,,Light,10:06:00 AM,81.1,,54.9,10:10:00 AM,Clear,,,,,D01,2024-09-20 10:06:00,88.57135402569602,82.46800109350113
9/20/2024 14:13:12,Cesar Pascal Vasquez,2024-09-20,BD,161 St-Yankee Stadium,86.7,69.7,,Medium,11:18:00 AM,84.3,,68.2,11:22:00 AM,Clear,,,,,D11,2024-09-20 11:18:00,96.66493921418083,90.52733063073585
9/20/2024 14:15:46,Cesar Pascal Vasquez,2024-09-20,BD,167 St,82.3,67.0,,Light,11:30:00 AM,82.5,,54.3,11:35:00 AM,Clear,,,,,D10,2024-09-20 11:30:00,86.3237727276001,84.06188863932503
9/20/2024 14:17:52,Cesar Pascal Vasquez,2024-09-20,BD,170 St,83.6,66.3,,Light,11:43:00 AM,82.9,,65.1,11:49:00 AM,Clear,,,,,D09,2024-09-20 11:43:00,88.54310343552416,86.9428598020609
9/20/2024 14:19:32,Cesar Pascal Vasquez,2024-09-20,BD,174-175 Sts,85.3,68.6,,Light,11:57:00 AM,82.5,,50.5,12:01:00 PM,Clear,,,,,D08,2024-09-20 11:57:00,92.85125482638405,83.40332270812503
9/20/2024 14:21:30,Cesar Pascal Vasquez,2024-09-20,BD,Tremont Av,84.8,63.8,,Medium,12:10:00 PM,81.7,,49.3,12:15:00 PM,Clear,,,,,D07,2024-09-20 12:10:00,90.09382346329586,82.35043934570103
9/20/2024 14:23:03,Cesar Pascal Vasquez,2024-09-20,BD,182-183 Sts,85.6,68.3,,Light,12:23:00 PM,82.3,,54.3,12:28:00 PM,Clear,,,,,D06,2024-09-20 12:23:00,93.41513810520398,83.809680230141
9/20/2024 14:24:39,Cesar Pascal Vasquez,2024-09-20,BD,Fordham Rd,86.4,67.8,,Medium,12:38:00 PM,83.5,,54.6,12:42:00 PM,Clear,,,,,D05,2024-09-20 12:38:00,95.06447437510418,85.45303022359994
9/20/2024 14:26:36,Cesar Pascal Vasquez,2024-09-20,BD,Kingsbridge Rd,84.2,68.1,,Light,12:53:00 PM,84.0,,63.4,12:57:00 PM,Clear,,,,,D04,2024-09-20 12:53:00,90.2854381317039,88.46509531920006
9/20/2024 14:27:48,Cesar Pascal Vasquez,2024-09-20,BD,Bedford Park Blvd,85.0,68.3,,Light,1:08:00 PM,80.7,,49.6,1:12:00 PM,Clear,,,,,D03,2024-09-20 13:08:00,92.06900801019995,81.40068876788405
